{"run":72,"commit":"68064ac","metric":364,"metrics":{"h7_eval_ms":108},"status":"keep","description":"Mini financial model E2E: SUM(Sales), SUM(Costs), gross profit, ROUND(margin%,1), nested IF rating. Named ranges, 5-level formula chain, nested IF(\"GOOD\"/\"OK\"/\"LOW\"). 1 capstone test. 333/333.","timestamp":1773883670477,"segment":0}
{"run":73,"commit":"19cf77c","metric":373,"metrics":{"h7_eval_ms":108},"status":"keep","description":"evalProgramDirect: zero-Effect-overhead eval path. Plain JS stack, no TxRef/transaction/generator. 38.6x faster than Effect path (3.5ms vs 135.8ms for 10K evals). FormulaEngineV2 recalc now uses direct path. 3 new tests incl perf comparison. 336/336.","timestamp":1773883906608,"segment":0}
{"run":74,"commit":"9547d48","metric":361,"metrics":{"h7_eval_ms":108},"status":"keep","description":"evalProgramDirect: skip trail recording (empty array). Removes per-opcode trail.push + depth tracking. 71.3x faster than Effect path (1.7ms vs 122.3ms for 10K evals, 0.17µs/eval). 336/336.","timestamp":1773883955731,"segment":0}
{"run":75,"commit":"4a1cb18","metric":379,"metrics":{"h7_eval_ms":108},"status":"keep","description":"Date/time opcodes: YEAR/MONTH/DAY/HOUR/MINUTE/SECOND_OP + TODAY_OP (77 opcodes). =YEAR(NOW())→2026, TODAY() volatile at midnight. FUNCTION_CATALOG now 46 entries. 2 new tests. 338/338.","timestamp":1773884109432,"segment":0}
{"run":76,"commit":"272b9b9","metric":300,"metrics":{"h7_eval_ms":108},"status":"keep","description":"Coercion opcodes: VALUE_OP (text→num), TYPE_OP (type name), N_OP (Excel N: bool→1/0, text→0). 80 opcodes total. FUNCTION_CATALOG now 49 entries. 3 new tests. 341/341.","timestamp":1773884221582,"segment":0}
{"run":77,"commit":"c3a4fc9","metric":295,"metrics":{"h7_eval_ms":108},"status":"keep","description":"SWITCH_N opcode: multi-way match =SWITCH(val, m1,r1, m2,r2, ..., default?). 81 opcodes. FUNCTION_CATALOG 50 entries (milestone!). No-match error, optional default. 1 new test. 342/342.","timestamp":1773884330917,"segment":0}
{"run":78,"commit":"91c5354","metric":363,"metrics":{"h7_eval_ms":108},"status":"keep","description":"IFS_N opcode: multi-condition branching =IFS(cond1,val1, cond2,val2,...). First truthy condition wins. 82 opcodes. FUNCTION_CATALOG 51 entries. 1 new test. 343/343.","timestamp":1773884399062,"segment":0}
{"run":79,"commit":"6f9e162","metric":362,"metrics":{"h7_eval_ms":108},"status":"keep","description":"Text functions: REPT_OP (repeat N times), EXACT_OP (case-sensitive compare), FIND_OP (1-based substring position). 85 opcodes. FUNCTION_CATALOG 54 entries. Overflow protection on REPT >10K. 1 new test. 344/344.","timestamp":1773884474124,"segment":0}
{"run":80,"commit":"f151891","metric":341,"metrics":{"h7_eval_ms":108},"status":"keep","description":"decompileIR: StackIR → readable formula string. Handles binary ops, unary/binary/ternary functions, N-ary aggregates, cell refs, constants, booleans. Constant-folded expressions decompile to their folded form. Barrel exported. 1 new test. 345/345.","timestamp":1773884580701,"segment":0}
{"run":81,"commit":"24f34e7","metric":409,"metrics":{"h7_eval_ms":108},"status":"keep","description":"REPLACE_OP (4-arg positional replace) + SEARCH_OP (case-insensitive FIND). 87 opcodes. FUNCTION_CATALOG 56 entries. Decompiler updated for REPLACE. 2 new tests. 347/347.","timestamp":1773884702891,"segment":0}
{"run":82,"commit":"e884eac","metric":364,"metrics":{"h7_eval_ms":108},"status":"keep","description":"evalProgramBulk: batch N IR evaluations in a single Effect.transaction. Amortizes STM journal setup across N programs. Barrel exported. 1 new test. 348/348.","timestamp":1773884753015,"segment":0}
{"run":83,"commit":"3076c24","metric":361,"metrics":{"h7_eval_ms":108},"status":"keep","description":"TEXTJOIN_N: variadic delimiter-joined string concat with ignore_empty flag. =TEXTJOIN(\",\",TRUE,\"a\",\"b\",\"c\")→\"a,b,c\". 88 opcodes. FUNCTION_CATALOG 57 entries. 1 new test. 349/349.","timestamp":1773884837493,"segment":0}
{"run":84,"commit":"46fd2de","metric":351,"metrics":{"h7_eval_ms":108},"status":"keep","description":"Invoice generator capstone: 7-formula chain (line items, subtotal, 8% tax, grand total, IFS tier rating). Exercises SUM, ROUND, MUL, IFS, GT across FormulaEngineV2 with cascading recalc. 350 tests (milestone!). 350/350.","timestamp":1773884885766,"segment":0}
{"run":85,"commit":"8beaacc","metric":364,"metrics":{"h7_eval_ms":108},"status":"keep","description":"analyzeIR: complexity metrics (opcodeCount, cellRefs, rangeRefs, functionCalls, maxStackDepth, volatile, constantFolded). Percent-of-total E2E test. 88 opcodes, 57 catalog entries. 2 new tests. 352/352.","timestamp":1773884964701,"segment":0}
{"run":86,"commit":"c025f01","metric":379,"metrics":{"h7_eval_ms":108},"status":"keep","description":"Share empty registers object across emptyState() calls (never mutated). Eliminates 1 object alloc per eval. Minor GC improvement. 352/352.","timestamp":1773885003397,"segment":0}
{"run":87,"commit":"a3e1acb","metric":388,"metrics":{"h7_eval_ms":108},"status":"keep","description":"CONCATENATE_N: variadic string join (no delimiter, legacy Excel CONCATENATE). 90 opcodes. FUNCTION_CATALOG 58 entries. 1 new test. 353/353.","timestamp":1773885080628,"segment":0}
{"run":88,"commit":"cecfcc4","metric":392,"metrics":{"h7_eval_ms":108},"status":"keep","description":"RANK_N: rank value within set (descending, 1=highest). =RANK(30,10,20,30,40,50)→3. 91 opcodes. FUNCTION_CATALOG 59 entries. 1 new test. 354/354.","timestamp":1773885203448,"segment":0}
{"run":89,"commit":"15f47c5","metric":404,"metrics":{"h7_eval_ms":108},"status":"keep","description":"MEDIAN_N: sorted middle value (even count → average of two middles). 92 opcodes. FUNCTION_CATALOG 60 entries (milestone!). 1 new test. 355/355.","timestamp":1773885280004,"segment":0}
{"run":90,"commit":"c309c31","metric":366,"metrics":{"h7_eval_ms":108},"status":"keep","description":"STDEV_N: sample standard deviation (Bessel correction, n-1). =ROUND(STDEV(2,4,4,4,5,5,7,9),3)→2.138. Error on <2 values. 93 opcodes. FUNCTION_CATALOG 61 entries. 1 new test. 356/356.","timestamp":1773885358152,"segment":0}
{"run":91,"commit":"f681364","metric":372,"metrics":{"h7_eval_ms":108},"status":"keep","description":"COUNTIF_N + SUMIF_N: criteria-based aggregation with parseCriteria utility (supports >, >=, <, <=, <>, =, wildcard*, exact match). 95 opcodes. FUNCTION_CATALOG 63 entries. 2 new tests. 358/358.","timestamp":1773885621215,"segment":0}
{"run":92,"commit":"8b1a7b9","metric":382,"metrics":{"h7_eval_ms":108},"status":"keep","description":"AVERAGEIF_N (criteria avg, DIV/0 on no matches) + LARGE_N/SMALL_N (k-th largest/smallest with bounds check). 98 opcodes. FUNCTION_CATALOG 66 entries. 2 new tests. 360/360.","timestamp":1773885726770,"segment":0}
{"run":93,"commit":"6f83d12","metric":382,"metrics":{"h7_eval_ms":108},"status":"keep","description":"PROPER_OP (title case) + CLEAN_OP (strip non-printable). 100 opcodes (99 Schema + HALT). FUNCTION_CATALOG 68 entries. Decompiler updated. 2 new tests. 362/362.","timestamp":1773885845203,"segment":0}
{"run":94,"commit":"7def98a","metric":377,"metrics":{"h7_eval_ms":108},"status":"keep","description":"🎉 100+ OPCODE MILESTONE! CHAR_OP (codepoint→char) + CODE_OP (char→codepoint). 101 Schema opcodes. FUNCTION_CATALOG 70 entries. Decompiler updated. 1 new test. 363/363.","timestamp":1773885926916,"segment":0}
{"run":95,"commit":"6431b80","metric":422,"metrics":{"h7_eval_ms":108},"status":"keep","description":"formatVMError + formatCellValue: Excel-style error display (#DIV/0!, #VALUE!, #REF!, #NAME?, #CALC!). Maps all error codes. Barrel exported. 1 new test. 364/364.","timestamp":1773885975903,"segment":0}
{"run":96,"commit":"fe71df1","metric":381,"metrics":{"h7_eval_ms":108},"status":"keep","description":"Data analysis capstone: 5-formula chain (COUNTIF, SUMIF, AVERAGEIF, MEDIAN, LARGE) on 8-cell dataset. Exercises conditional aggregation + stat functions in FormulaEngineV2. 365/365.","timestamp":1773886016225,"segment":0}
{"run":97,"commit":"0a14ab5","metric":380,"metrics":{"h7_eval_ms":108},"status":"keep","description":"T_OP (text or \"\"), ISEVEN_OP, ISODD_OP, ISNUMBER alias. 104 opcodes. FUNCTION_CATALOG 75 entries. Decompiler updated. 3 new tests. 368/368.","timestamp":1773886110890,"segment":0}
{"run":98,"commit":"4c55ca7","metric":370,"metrics":{"h7_eval_ms":108},"status":"keep","description":"INT_OP (floor toward -∞), EVEN_OP (round up to even), ODD_OP (round up to odd). 107 opcodes. FUNCTION_CATALOG 78 entries. Decompiler updated. 1 new test. 369/369.","timestamp":1773886206406,"segment":0}
{"run":99,"commit":"6da4b8a","metric":364,"metrics":{"h7_eval_ms":108},"status":"keep","description":"TRUNC_OP (truncate toward zero, differs from INT/FLOOR) + COMBIN_OP (nCr combinations). 109 opcodes. FUNCTION_CATALOG 80 entries (milestone!). 2 new tests. 371/371.","timestamp":1773886288047,"segment":0}
{"run":100,"commit":"a366a0e","metric":384,"metrics":{"h7_eval_ms":108},"status":"keep","description":"🎉 EXPERIMENT 100! Full spreadsheet capstone: 9-formula product pricing sheet exercising MUL, SUM, AVG, MEDIAN, CONCATENATE, UPPER, LEFT, MID, LOWER, IFS, ISEVEN across FormulaEngineV2 with 3-level cascading recalc. 109 opcodes. 80 catalog. 372/372.","timestamp":1773886338015,"segment":0}
{"run":101,"commit":"2aaca3d","metric":356,"metrics":{"h7_eval_ms":108},"status":"keep","description":"GCD_OP + LCM_OP: Euclidean GCD algorithm + LCM via a/gcd*b. 111 Schema opcodes. FUNCTION_CATALOG 82. 1 new test. 373/373.","timestamp":1773886447825,"segment":0}
{"run":102,"commit":"2c3041d","metric":414,"metrics":{"h7_eval_ms":108},"status":"keep","description":"FACT_OP (n!, overflow guard at 170) + QUOTIENT_OP (integer division toward zero, DIV/0 guard). 113 opcodes. FUNCTION_CATALOG 84 entries. 2 new tests. 375/375.","timestamp":1773886530694,"segment":0}
{"run":103,"commit":"1074cc5","metric":374,"metrics":{"h7_eval_ms":108},"status":"keep","description":"Full trigonometry: SIN, COS, TAN, ASIN (domain-checked), ACOS, ATAN, ATAN2 (2-arg), RADIANS, DEGREES. 122 opcodes. FUNCTION_CATALOG 93 entries. Decompiler updated. 1 new test. 376/376.","timestamp":1773886654078,"segment":0}
{"run":104,"commit":"a05de18","metric":376,"metrics":{"h7_eval_ms":108},"status":"keep","description":"EXP_OP (e^x) + LN_OP (natural log, domain-checked for non-positive). EXP(1)→2.71828, LN(EXP(2))→2 roundtrip. 124 opcodes. FUNCTION_CATALOG 95 entries. 1 new test. 377/377.","timestamp":1773886769091,"segment":0}
{"run":105,"commit":"b6b2ebb","metric":376,"metrics":{"h7_eval_ms":108},"status":"keep","description":"SUMPRODUCT_N: pairwise multiply + sum (weighted calculations). =SUMPRODUCT(1,2,3,4,5,6)→32. 125 opcodes. FUNCTION_CATALOG 96 entries. 1 new test. 378/378.","timestamp":1773886861174,"segment":0}
{"run":106,"commit":"6e9c65c","metric":401,"metrics":{"h7_eval_ms":108},"status":"keep","description":"LOG2_OP, RANDBETWEEN (volatile), FIXED_OP (number formatting), DOLLAR_OP (currency string). 129 opcodes. FUNCTION_CATALOG 100 entries (ONE MORE!). Volatile set updated. 1 new test. 379/379.","timestamp":1773886989869,"segment":0}
{"run":107,"commit":"b86d9f8","metric":371,"metrics":{"h7_eval_ms":108},"status":"keep","description":"🎉 100 FUNCTION CATALOG! ERROR_TYPE_OP (numeric error code mapping). 130 opcodes. FUNCTION_CATALOG 100 entries. Decompiler updated. 1 new test. 380/380.","timestamp":1773887082213,"segment":0}
{"run":108,"commit":"8cb8643","metric":365,"metrics":{"h7_eval_ms":108},"status":"keep","description":"SINH/COSH/TANH: hyperbolic trigonometry. 133 opcodes. FUNCTION_CATALOG 103 entries. 1 new test. 381/381.","timestamp":1773887225611,"segment":0}
{"run":109,"commit":"04d5526","metric":452,"metrics":{"h7_eval_ms":108},"status":"keep","description":"COUNTA_N (count non-blank) + COUNTBLANK_N (count blank). 135 opcodes. FUNCTION_CATALOG 105 entries. 1 new test. 382/382.","timestamp":1773887320142,"segment":0}
{"run":110,"commit":"64865fd","metric":400,"metrics":{"h7_eval_ms":108},"status":"keep","description":"MROUND_OP: round to nearest multiple. =MROUND(7,5)→5, =MROUND(8,5)→10, =MROUND(1.3,0.5)→1.5. 136 opcodes. FUNCTION_CATALOG 106. 1 new test. 383/383.","timestamp":1773887405712,"segment":0}
{"run":111,"commit":"fad385d","metric":414,"metrics":{"h7_eval_ms":108},"status":"keep","description":"Financial functions: PMT (loan payment), FV (future value), PV (present value). Rate=0 edge case handled. 139 opcodes. FUNCTION_CATALOG 109 (new 'financial' category). 1 new test. 384/384.","timestamp":1773887527950,"segment":0}
{"run":112,"commit":"f89f687","metric":380,"metrics":{"h7_eval_ms":108},"status":"keep","description":"Mortgage calculator capstone: 5-formula chain (monthly rate, total payments, PMT, total paid, total interest) with cascading recalc across FormulaEngineV2. 385/385.","timestamp":1773887569791,"segment":0}
{"run":113,"commit":"6ad24d2","metric":405,"metrics":{"h7_eval_ms":108},"status":"keep","description":"NPER_OP: number of payment periods. =NPER(0.05/12, -200, 10000)→56.2 months. Edge cases: rate=0, pmt=0, no-solution. 140 opcodes. FUNCTION_CATALOG 110 entries. 1 new test. 386/386.","timestamp":1773887729033,"segment":0}
{"run":114,"commit":"percent","metric":373,"metrics":{"h7_eval_ms":108},"status":"keep","description":"PERCENTILE_N: k-th percentile with linear interpolation. =PERCENTILE(0.5,1,2,3,4,5)→3 (median). Domain-checked. 141 opcodes. FUNCTION_CATALOG 111 entries. 1 new test. 387/387.","timestamp":1773887827823,"segment":0}
{"run":115,"commit":"efdafdd","metric":491,"metrics":{"h7_eval_ms":108},"status":"keep","description":"VAR_N: sample variance (Bessel-corrected, STDEV²). Completes stat pair. 142 opcodes. FUNCTION_CATALOG 112 entries. 1 new test. 388/388.","timestamp":1773887928081,"segment":0}
{"run":116,"commit":"npv","metric":366,"metrics":{"h7_eval_ms":108},"status":"keep","description":"NPV_N: net present value of discounted cash flows. =NPV(0.1, -1000, 300, 420, 680)→~118.78. 143 opcodes. FUNCTION_CATALOG 113 entries. 1 new test. 389/389.","timestamp":1773888039268,"segment":0}
{"run":117,"commit":"0fa7fd1","metric":296,"metrics":{"h7_eval_ms":108},"status":"keep","description":"ROUNDUP_OP (round away from zero) + ROUNDDOWN_OP (round toward zero). 2-arg with digits precision. 145 opcodes. FUNCTION_CATALOG 115 entries. 1 new test. 390/390.","timestamp":1773888121133,"segment":0}
{"run":118,"commit":"1c2cf3e","metric":288,"metrics":{"h7_eval_ms":108},"status":"keep","description":"ISLOGICAL_OP + ISNONTEXT_OP: complete IS* family. 147 opcodes. FUNCTION_CATALOG 117 entries. Decompiler updated. 1 new test. 391/391.","timestamp":1773888212597,"segment":0}
{"run":119,"commit":"198a9a0","metric":296,"metrics":{"h7_eval_ms":108},"status":"keep","description":"MAXIFS_N + MINIFS_N: conditional max/min with parseCriteria. Completes the conditional aggregation family. 149 opcodes. FUNCTION_CATALOG 119 entries. 1 new test. 392/392.","timestamp":1773888319624,"segment":0}
{"run":120,"commit":"8197b43","metric":335,"metrics":{"h7_eval_ms":108},"status":"keep","description":"IRR_N: internal rate of return via Newton-Raphson iteration (100 max iters, 1e-10 convergence). SLN_OP: straight-line depreciation. 151 opcodes. FUNCTION_CATALOG 121. 2 new tests. 394/394.","timestamp":1773888567710,"segment":0}
{"run":121,"commit":"15cc1c4","metric":353,"metrics":{"h7_eval_ms":108},"status":"keep","description":"RATE_OP: solve for interest rate via Newton-Raphson (+reverse PMT). DB_OP: declining balance depreciation (Excel 3-dp rounded rate). 153 opcodes. FUNCTION_CATALOG 123. 2 new tests. 396/396.","timestamp":1773888662342,"segment":0}
{"run":122,"commit":"83781c4","metric":383,"metrics":{"h7_eval_ms":108},"status":"keep","description":"TEXT_OP: number formatting (0.00, #,##0, 0%). NUMBERVALUE_OP: text→number parser (strips $, commas, handles %). 155 opcodes. FUNCTION_CATALOG 125. 2 new tests. 398/398.","timestamp":1773888845494,"segment":0}
{"run":123,"commit":"c930f4f","metric":376,"metrics":{"h7_eval_ms":108},"status":"keep","description":"🎉 400 TESTS! CEILING.MATH + FLOOR.MATH (round to significance). Dotted function name tokenizer support. Investment analysis capstone (NPV+IRR+TEXT+IF). 157 opcodes. FUNCTION_CATALOG 127. 400/400.","timestamp":1773889024154,"segment":0}
{"run":124,"commit":"d22a8d8","metric":370,"metrics":{"h7_eval_ms":108},"status":"keep","description":"COUNTIFS_N: multi-criteria count with AND logic (dual parseCriteria). 158 opcodes. FUNCTION_CATALOG 128 entries. 1 new test. 401/401.","timestamp":1773889118667,"segment":0}
{"run":125,"commit":"9ed3866","metric":396,"metrics":{"h7_eval_ms":108},"status":"keep","description":"SQRTPI_OP, BASE_OP (num→text in radix 2-36), DECIMAL_OP (text→num from radix), AVERAGE alias, COUNTIFS_N. Dotted-name tokenizer. 161 opcodes. FUNCTION_CATALOG 132. 404/404.","timestamp":1773889279562,"segment":0}
{"run":126,"commit":"43ffb14","metric":433,"metrics":{"h7_eval_ms":108},"status":"keep","description":"AGGREGATE_N: versatile aggregation dispatcher (10 function_nums: AVG, COUNT, COUNTA, MAX, MIN, PRODUCT, STDEV, SUM, MEDIAN, VAR). 162 opcodes. FUNCTION_CATALOG 133. 1 new test. 405/405.","timestamp":1773889415546,"segment":0}
{"run":127,"commit":"fadacec","metric":434,"metrics":{"h7_eval_ms":108},"status":"keep","description":"ROMAN_OP (num→Roman, 1-3999) + ARABIC_OP (Roman→num). =ROMAN(2024)→\"MMXXIV\", =ARABIC(\"XLII\")→42. 164 opcodes. FUNCTION_CATALOG 135. 1 new test. 406/406.","timestamp":1773889516150,"segment":0}
{"run":128,"commit":"090475d","metric":413,"metrics":{"h7_eval_ms":108},"status":"keep","description":"WEEKDAY_OP (serial→day-of-week 1=Sun..7=Sat) + WEEKNUM_OP (serial→week-number). Excel serial date compatible. 166 opcodes. FUNCTION_CATALOG 137. 1 new test. 407/407.","timestamp":1773889627514,"segment":0}
{"run":129,"commit":"7bceba2","metric":359,"metrics":{"h7_eval_ms":108},"status":"keep","description":"DATEVALUE_OP (parse date string→Excel serial), EDATE_OP (serial + months). Date/time category now 8 functions. 168 opcodes. FUNCTION_CATALOG 139. 1 new test. 408/408.","timestamp":1773889718032,"segment":0}
{"run":130,"commit":"mode-ha","metric":307,"metrics":{"h7_eval_ms":108},"status":"keep","description":"MODE_N (most frequent value), HARMEAN_N (harmonic mean), GEOMEAN_N (geometric mean). Advanced stat trio. 171 opcodes. FUNCTION_CATALOG 142. 1 new test. 409/409.","timestamp":1773889815824,"segment":0}
{"run":131,"commit":"3f18ef9","metric":297,"metrics":{"h7_eval_ms":108},"status":"keep","description":"MATCH_N (find position of value in list, 1-based) + INDEX_N (return value at position). Lookup primitives — enables INDEX+MATCH pattern. 173 opcodes. FUNCTION_CATALOG 144. 1 new test. 410/410.","timestamp":1773889924313,"segment":0}
{"run":132,"commit":"97f32fb","metric":296,"metrics":{"h7_eval_ms":108},"status":"keep","description":"🎉 150 FUNCTION CATALOG! IFNA, EOMONTH, DATEDIF (D/M/Y), DAYS, PERMUT, FACTDOUBLE + MATCH/INDEX from prev. 179 opcodes. 150 catalog entries. 1 new test. 411/411.","timestamp":1773890116127,"segment":0}
{"run":133,"commit":"9f946cd","metric":359,"metrics":{"h7_eval_ms":108},"status":"keep","description":"Analytics dashboard capstone: AGGREGATE(SUM/AVG/MAX) + TEXT formatting + PERCENTILE across 5-cell dataset with multi-formula cascade. 412/412.","timestamp":1773890168899,"segment":0}
{"run":134,"commit":"07ebcd5","metric":379,"metrics":{"h7_eval_ms":108},"status":"keep","description":"ENCODEURL_OP: percent-encode text for URL construction. 180 opcodes. FUNCTION_CATALOG 151. 1 new test. 413/413.","timestamp":1773890243654,"segment":0}
{"run":135,"commit":"82f05f4","metric":350,"metrics":{"h7_eval_ms":108},"status":"keep","description":"UNICODE_OP (codePointAt) + UNICHAR_OP (fromCodePoint). Full Unicode including emoji: =UNICHAR(128512)→\"😀\". Round-trip tested. 182 opcodes. FUNCTION_CATALOG 153. 1 new test. 414/414.","timestamp":1773890311253,"segment":0}
{"run":136,"commit":"8ae28c3","metric":374,"metrics":{"h7_eval_ms":108},"status":"keep","description":"NA_OP (generates #N/A error), COT_OP (cotangent), ACOT_OP (inverse cotangent). =IFNA(NA(), 42)→42 pattern tested. 185 opcodes. FUNCTION_CATALOG 156. 1 new test. 415/415.","timestamp":1773890384206,"segment":0}
{"run":137,"commit":"f7dc725","metric":354,"metrics":{"h7_eval_ms":108},"status":"keep","description":"Full-breadth capstone: 6-formula chain spanning Math+Text+Financial+Logic+Info+Trig. SQRT→CONCAT+UPPER+TEXT→PMT→IF→ISNUMBER→SIN+RADIANS cascading recalc. 416/416.","timestamp":1773890436928,"segment":0}
{"run":138,"commit":"af79409","metric":370,"metrics":{"h7_eval_ms":108},"status":"keep","description":"SEC, CSC, COTH, SECH, CSCH (complete trig/hyp suite) + SUMIFS_N, AVERAGEIFS_N (multi-criteria AND aggregation). 192 opcodes. FUNCTION_CATALOG 163. 2 new tests. 418/418.","timestamp":1773890697737,"segment":0}
{"run":139,"commit":"1b1357f","metric":387,"metrics":{"h7_eval_ms":108},"status":"keep","description":"Engineering functions: DELTA (Kronecker), GESTEP (step), MULTINOMIAL (multinomial coefficient), SERIESSUM (power series). 196 opcodes. FUNCTION_CATALOG 167. 1 new test. 419/419.","timestamp":1773890785882,"segment":0}
{"run":140,"commit":"501084d","metric":356,"metrics":{"h7_eval_ms":108},"status":"keep","description":"🎉 200 OPCODES! XOR_N (exclusive OR), ISOWEEKNUM_OP (ISO 8601 week), NETWORKDAYS_OP (business days), SUBTOTAL_N (Excel SUBTOTAL dispatcher). FUNCTION_CATALOG 171. 1 new test. 420/420.","timestamp":1773890893020,"segment":0}
{"run":141,"commit":"9eb1081","metric":373,"metrics":{"h7_eval_ms":108},"status":"keep","description":"SUMSQ_N (Σx²), DEVSQ_N (sum squared deviations), AVEDEV_N (avg absolute deviation), TRIMMEAN_N (trimmed mean). 204 opcodes. FUNCTION_CATALOG 175. 1 new test. 421/421.","timestamp":1773890989285,"segment":0}
