{"run":249,"commit":"c0169d5","metric":364,"metrics":{"h7_eval_ms":108},"status":"keep","description":"1099 UNIQUE CATALOG! 52 new verified-unique functions: math (RECIP/SQRDIFF/HYPERBOLIC/SINCOS/EXPM1ALT/LOG1PALT/CBRT2/NTHPOWER/DIVSAFE/MODSAFE/NEGONE/FRAC2/WHOLEFRAC/ROUNDN), stat time-series (EWMA/CUMMAX/CUMMIN/CUMSUM2/CUMPROD2/DIFFLAG/PCTCHANGE/ROLLMAX/ROLLMIN/ROLLAVG), text (TEXTSHRINK/TEXTEXPAND/TEXTORDINAL/TEXTPLURAL/TEXTSINGULAR/TEXTCAPS/TEXTNOCAPS/TEXTFIRST/TEXTLAST/TEXTMID), info (ISARRAY/ISSCALAR/BITWIDTH/BYTECOUNT/NUMCLASS/HEXVAL), financial ratios (EBITDA/GROSSPROFIT/NETINCOME/ASSETRATIO/DEBTRATIO/QUICKRATIO), logic (CLAMPBOOL/BOOLFLIP/TERNARY/NULLCOAL), lookup (ZIPWITH/SCAN/REDUCE2). 11,980 LOC. 881 tests.","timestamp":1773917865786,"segment":0}
{"run":250,"commit":"5cce142","metric":397,"metrics":{"h7_eval_ms":108},"status":"keep","description":"25 new tests for 1100 batch: RECIP/SQRDIFF/CBRT2/DIVSAFE/FRAC2/WHOLEFRAC/ROUNDN (math), CUMMAX/CUMMIN/CUMSUM2/CUMPROD2 (stat), TEXTORDINAL/TEXTCAPS/TEXTNOCAPS (text), ISSCALAR/BITWIDTH/NUMCLASS (info), GROSSPROFIT (financial), TERNARY/BOOLFLIP (logic). Tests: 881→906! 1099 unique catalog. 11,980 LOC.","timestamp":1773918052823,"segment":0}
{"run":251,"commit":"25b5445","metric":394,"metrics":{"h7_eval_ms":108},"status":"keep","description":"1149 UNIQUE CATALOG! 50 new functions: math rounding/snapping (WRAP2/PINGPONG/FMULT/FDIV/LOGBASE/RSQRT/SIGN2/TRUNC2/ROUNDHALF/CEIL2/FLOOR2/SNAP), stat quartiles+signal (WMEAN/TMEAN/IQR2/Q1/Q3/DECILE/OUTLIER/PEAK/TROUGH/PLATEAU), text ops (TEXTTOKEN/TEXTJOINWITH/TEXTPREPEND/TEXTAPPEND/TEXTOVERLAP/TEXTCOMMON/TEXTUNCOMMON/TEXTDIFF), info predicates (ISODD3/ISEVEN3/ISPOSINT/ISNEGINT/ISUNIT/ISBETWEEN), financial ratios (PERPAMT/PERPETUITY/LEVERAGE/COVERAGE/EARNINGSPS/PRICEEARNINGS), logic quantifiers (ANYOF/NONEOF/EXACTLYONE/ATMOSTK), lookup patterns (RUNLEN/STREAK/SPAN), volatile (RANDFOLD/RANDTRI). 12,187 LOC. 906 tests.","timestamp":1773918668291,"segment":0}
{"run":252,"commit":"937ffaf","metric":396,"metrics":{"h7_eval_ms":108},"status":"keep","description":"22 new tests for 1150 batch: SNAP/CEIL2/FLOOR2/TRUNC2/LOGBASE/SIGN2 (math), IQR2/PEAK/TROUGH (stat), STREAK/SPAN (lookup), ANYOF/NONEOF/EXACTLYONE (logic), ISODD3/ISEVEN3/ISPOSINT (info), TEXTAPPEND (text), PERPETUITY (financial). Tests: 906→928! 1149 unique catalog. 12,187 LOC.","timestamp":1773918853090,"segment":0}
{"run":253,"commit":"208bbfb","metric":334,"metrics":{"h7_eval_ms":108},"status":"keep","description":"🏆 1199 UNIQUE CATALOG! 50 new functions: physics constants (FARADAY/BOLTZMANN/PLANCK/AVOGADRO/COULOMB/HOOKE/OHMS/WATT/KELVIN/CELSIUS/FAHRENHEIT/NEWTON), statistics (BOOTSTRAPMEAN/JACKKNIFE/ANDERSON/SHAPIRO/KSTEST/AUTOCORR/CROSSCORR/CONVOL/DETREND/NORMALIZE2), text encoding (TEXTROT47/TEXTATBASH/TEXTXOR/TEXTNTH2/TEXTUNTIL/TEXTAFTER2/TEXTSPLIT2/TEXTWORDS), number theory classification (ISPRIMEPOWER/ISDEFICIENT/ISABUNDANT/ISSEMIPRIME/ISSQUAREFREE/ISSMOOTH), financial valuation (EVTOEBITDA/PRICEBOOK/PRICESALES/DIVIDENDPAYOUT/RETENTIONRATE/SGROWTH), temporal logic (RISING/FALLING/CHANGED/STABLE), lookup (SELECTIF/REJECTIF/TAKEWHILE/DROPWHILE). 12,394 LOC. 334ms! 928 tests.","timestamp":1773919635528,"segment":0}
{"run":254,"commit":"e056d72","metric":355,"metrics":{"h7_eval_ms":108},"status":"keep","description":"18 new tests for 1200 batch: KELVIN/CELSIUS/FAHRENHEIT/HOOKE/OHMS (physics), RETENTIONRATE (financial), RISING/FALLING/CHANGED/STABLE (logic), ISDEFICIENT/ISABUNDANT/ISSEMIPRIME/ISSQUAREFREE (number theory), TEXTWORDS (text), SELECTIF/TAKEWHILE (lookup). Tests: 928→946! 1199 unique catalog. 12,394 LOC.","timestamp":1773919781661,"segment":0}
{"run":255,"commit":"3cfffc1","metric":306,"metrics":{"h7_eval_ms":108},"status":"keep","description":"🏆 1249 UNIQUE CATALOG! 50 new functions: geometry (DOTPROD2/CROSSPROD/MAGNITUDE2/ANGLE/MIDPOINT/SLOPE/INTERCEPT2/PERPSLOPE/ARCLENGTH/SECTORAREA/HERON/BRAHMAGUPTA), robust stat (HUBERMU/HAMPEL/TUKEYBIWEIGHT/ANDREWSINE), norms (L1NORM/L2NORM/LINFNORM/LPNORM/MAHALANOBIS/COSINESIM), text analysis (TEXTFREQCHAR/TEXTUNIQCHARS/TEXTCHARCOUNT/TEXTPOSITION/TEXTOCCURRENCES/TEXTSTARTSWITH2/TEXTENDSWITH2/TEXTINCLUDES), exotic number theory (ISAMICABLE/ISAUTOMORPHIC/ISKAPREKAR/ISNARCISSISTIC/ISSMITH/ISPROTH), finance (WACC2/CAPM/GORDONMODEL/DDM/MVADDED/ECONVALUE), logic (ALLGT/ALLLT/ALLEQ/COUNTRUE), lookup (RANKPCT/QUANTILE2/MEDIAN2). 12,601 LOC. 306ms! 946 tests.","timestamp":1773920264999,"segment":0}
{"run":256,"commit":"6e0f223","metric":331,"metrics":{"h7_eval_ms":108},"status":"keep","description":"20 new tests for 1250 batch: MIDPOINT/PERPSLOPE/MAGNITUDE2/HERON (geometry), L1NORM/L2NORM/LINFNORM/COSINESIM (norms), ISNARCISSISTIC/ISAUTOMORPHIC/ISKAPREKAR (number theory), TEXTINCLUDES/TEXTUNIQCHARS/TEXTOCCURRENCES (text), COUNTRUE/ALLEQ/ALLGT (logic), MEDIAN2 (stat), GORDONMODEL (financial). Tests: 946→966! 1249 unique catalog. 12,601 LOC. 331ms!","timestamp":1773920433895,"segment":0}
{"run":257,"commit":"468c0ee","metric":373,"metrics":{"h7_eval_ms":108},"status":"keep","description":"🏆🏆 1300 UNIQUE CATALOG! 51 new functions across 3 mini-batches: combinatorics (STIRLING1/STIRLING2/BELL/CATALAN2/PARTITION/DERANGEMENT/SUBFACTORIAL/RISINGFACT/DOUBLEFALLINGFACT/MULTINOMIAL2/TRIBONACCI/PENTAGONAL), info theory (ENTROPY2/CROSSENTROPY/KLDIVERGE/JSDIVERGE/GINI2/THEIL/ATKINSON/PALMA/HOOVER), text transforms (TEXTCAESAR/TEXTMORSE/TEXTSLUG/TEXTSNAKE/TEXTKEBAB/TEXTPASCAL/TEXTCONSTANT/TEXTCAMELCASE/TEXTTITLECASE/TEXTSHUFFLE/TEXTDIGITSUM), number theory (ISPERFECTSQ/ISPERFECTCUBE/ISPOWER2/ISSOPHIE/ISSAFE), financial risk (SHARPE/SORTINO/TREYNOR/JENSEN/INFORATE), bitwise (BITAND/BITOR/BITXOR/BITNOT), figurate numbers (TETRAHEDRAL/PYRAMIDAL/LUCAS2/PELL/JACOBSTHAL/PRONIC/STAR/DECAGONAL/DODECAGONAL/ICOSAHEDRAL), lookup (FREQUENCY/MODEVALUE/PERCENTRANK). 12,825 LOC. 867 tests.","timestamp":1773921080882,"segment":0}
{"run":258,"commit":"0eee7fc","metric":366,"metrics":{"h7_eval_ms":108},"status":"keep","description":"30 new tests for 1300 batch: BELL/CATALAN2/PARTITION/DERANGEMENT/SUBFACTORIAL/TRIBONACCI/PENTAGONAL/RISINGFACT/STIRLING1/STIRLING2 (combinatorics), ENTROPY2 (info theory), TEXTSLUG/TEXTKEBAB/TEXTCAMELCASE/TEXTCAESAR (text transforms), ISPERFECTSQ/ISPERFECTCUBE/ISPOWER2/ISSOPHIE (number theory), BITAND/BITOR/BITXOR (bitwise), SHARPE (financial risk), PRONIC/LUCAS2/PELL/TETRAHEDRAL/STAR (figurate numbers), FREQUENCY (lookup). Tests: 867→897! 1300 unique catalog. 12,825 LOC.","timestamp":1773921345617,"segment":0}
{"run":259,"commit":"b4fd5a7","metric":372,"metrics":{"h7_eval_ms":108},"status":"keep","description":"🏆🏆🏆 1350 UNIQUE CATALOG! 50 new functions: numerical methods (TAYLORSIN/TAYLORCOS/TAYLOREXP/NEWTONMETHOD/BISECT/TRAPEZOID/SIMPSON/ROMBERG/EULERAPPROX/GOLDENSECTION/REGULAFALSI/SECANTMETHOD), time-series forecasting (ARIMA/HOLT/WINTERS/EXPSMOOTH/DOUBLEEXP/SEASONAVG/MOVMEDIAN/MOVSTDEV/MOVVAR/MOVRANGE), text hashing (TEXTCRC32/TEXTSOUNDEX/TEXTMETAPHONE/TEXTALPHANUM/TEXTZALGO2/TEXTUNICODE/TEXTFROMUNI/TEXTBIN), number theory (ISPRACTICAL/ISREGULAR/ISSUPERABUNDANT/ISHAPPY2/ISSAD/ISNICE), financial risk (MODIGLIANI/OMEGA/KAPPA/RACHEV/BURKE), logic quantifiers (MAJORITY3/CONSENSUS2/THRESHOLD2/QUORUM2), distributions (WEIGHTEDRANK/CDF/ECDF), volatile (RANDCHI2/RANDF). 13,032 LOC. 897 tests.","timestamp":1773921694215,"segment":0}
{"run":260,"commit":"0df25e2","metric":374,"metrics":{"h7_eval_ms":108},"status":"keep","description":"23 new tests for 1350 batch: TAYLOR_SIN/TAYLOR_COS/TAYLOR_EXP/BISECT/TRAPEZOID/GOLDEN_SECTION (numerical methods), EXPSMOOTH/MOVMEDIAN (time-series), TEXTCRC32/TEXTSOUNDEX/TEXTALPHANUM/TEXTUNICODE/TEXTFROMUNI (text encoding), ISHAPPY2/ISSAD/ISREGULAR (number theory), MAJORITY3/CONSENSUS2/QUORUM2 (logic), CDF/ECDF (distributions). Tests: 897→920! 1350 unique catalog. 13,032 LOC.","timestamp":1773921947473,"segment":0}
{"run":261,"commit":"fd57812","metric":367,"metrics":{"h7_eval_ms":108},"status":"keep","description":"🏆🏆🏆🏆 1400 UNIQUE CATALOG! 50 new functions: DSP/signal processing (DFT_MAG/HILBERT/XCORR/CONVOLVE/DOWNSAMPLE/UPSAMPLE/BUTTERWORTH/CHEBYSHEVFILT/BILINEAR/ZPLANE/POLYPHASE/CHIRP), regression/model (LEASTSQ/RIDGE/LASSO/ELASTICNET/LOGITFIT/PROBITFIT/RESIDUALS/LEVERAGE2/COOKSD/DURBIN_WATSON), text encoding (TEXTBASE32/TEXTHEX2/TEXTFROMHEX2/TEXTURL/TEXTFROMURL/TEXTHTML/TEXTFROMHTML/TEXTXML), number theory (ISSUPERIOR/ISUNTOUCHABLE/ISWEIRD/ISSPHENICNUM/ISACHILLES/ISPRODIGAL), portfolio risk (MAXDRAWDOWN2/CALMARRATIO/ULCERINDEX/PAINRATIO/MARTINGALE), logic signals (DEBOUNCE2/HYSTERESIS/EDGEDETECT/SCHMITT), lookup (GROUPBY/PIVOTSUM/UNPIVOT). 13,239 LOC. 920 tests.","timestamp":1773922415838,"segment":0}
{"run":262,"commit":"9a11381","metric":367,"metrics":{"h7_eval_ms":108},"status":"keep","description":"16 new tests for 1400 batch: BUTTERWORTH (DSP), TEXTURL/TEXTFROMURL/TEXTHTML/TEXTHEX2 (encoding), LEASTSQ/DURBINWATSON (regression), EDGEDETECT/HYSTERESIS (signal logic), ISSPHENICNUM (number theory), DOWNSAMPLE (DSP), GROUPBY/PIVOTSUM (lookup), ULCERINDEX/MARTINGALE (portfolio risk). Tests: 920→936! 1400 unique catalog. 13,239 LOC.","timestamp":1773922561293,"segment":0}
