{"run":203,"commit":"0ca6e62","metric":302,"metrics":{"h7_eval_ms":108},"status":"keep","description":"12-function batch: ML activation functions (SIGMOID/RELU/SOFTPLUS/ELU), Normalization (NORMALIZE/MAPRANGE), Stat conditionals (PRODUCTIF/MEDIANIF), Info (ISDATE/DIGITS), Text (TEXTCENTER/WORDCOUNT). math:141 stat:126 text:73 info:72. 524 opcodes. CATALOG 531. 7,683 LOC. 302ms. 536/536.","timestamp":1773903139051,"segment":0}
{"run":204,"commit":"3551dd6","metric":344,"metrics":{"h7_eval_ms":108},"status":"keep","description":"12 more tests: SIGMOID/RELU/SOFTPLUS/ELU (ML activations), NORMALIZE, WORDCOUNT, DIGITS, DECODEURL. Tests: 536→548! 531 catalog. 524 opcodes.","timestamp":1773903289709,"segment":0}
{"run":205,"commit":"4791ad8","metric":305,"metrics":{"h7_eval_ms":108},"status":"keep","description":"11-function batch: Case converters (TEXTCAMELCASE/TEXTSNAKECASE/TEXTKEBABCASE/TEXTINITIALS/TEXTROTATE), Encoding (BASE64.ENCODE/BASE64.DECODE), Stat modes (MODE.SNGL/MODE.MULT), Math (ROUNDMODE), Lookup (WRAPCOLS). text:80! math:142 stat:128. 535 opcodes. CATALOG 542. 7,821 LOC. 305ms. 548/548.","timestamp":1773903758055,"segment":0}
{"run":206,"commit":"0321408","metric":289,"metrics":{"h7_eval_ms":108},"status":"keep","description":"6 more tests: TEXTCAMELCASE/TEXTSNAKECASE/TEXTKEBABCASE/TEXTINITIALS (case conversion), BASE64.ENCODE/BASE64.DECODE (encoding). Tests: 548→554! 542 catalog. 535 opcodes. 289ms (62% below baseline!).","timestamp":1773903903660,"segment":0}
{"run":207,"commit":"dcb1577","metric":320,"metrics":{"h7_eval_ms":108},"status":"keep","description":"10-function batch: Time series (CUMSUM/CUMPROD/MOVAVG), Bitwise (BITNOT/BITROTL/BITROTR), Text (JSONIFY/TEXTTITLE), Info (ISNAN/ISINFINITE). math:145 stat:131 text:82 info:74. 545 opcodes. CATALOG 552! 7,924 LOC. 320ms. 554/554.","timestamp":1773904339937,"segment":0}
{"run":208,"commit":"7d26011","metric":299,"metrics":{"h7_eval_ms":108},"status":"keep","description":"Re-baseline after context restore. 552 catalog, 545 opcodes, 554 tests, 7924 LOC. All green at 299ms.","timestamp":1773904607973,"segment":0}
{"run":209,"commit":"aaf3230","metric":291,"metrics":{"h7_eval_ms":108},"status":"keep","description":"13-function batch: Financial depreciation (SLN/SYD/DDB), Rate functions (RATE/EFFECT.RATE/NOMINAL), Stat (ZSCORE/PERCENTRANK), Logic gates (NAND/NOR/XNOR), Text (TEXTMASK/TEXTTRUNCATE). financial:58 logic:27 stat:134. 551 opcodes. CATALOG 565! 8,064 LOC. 291ms. 554/554.","timestamp":1773905072684,"segment":0}
{"run":210,"commit":"4de00ff","metric":302,"metrics":{"h7_eval_ms":108},"status":"keep","description":"16 new tests: SLN/SYD/EFFECT.RATE/NOMINAL (depreciation+rates), NAND/NOR/XNOR (logic gates), TEXTMASK/TEXTTRUNCATE/TEXTTITLE (text), ZSCORE (stat). Tests: 554→570! 565 catalog. 551 opcodes.","timestamp":1773905180948,"segment":0}
{"run":211,"commit":"95fc0e6","metric":303,"metrics":{"h7_eval_ms":108},"status":"keep","description":"13-function batch: Financial (CAGR/DISC/DOLLARDE/DOLLARFR), Stat (ENTROPY/GINI/WINSORIZE), Math (HYPOT3/DISTANCE2D/MANHATTAN/FIBONACCI/COLLATZ), Info (TYPEOF2). math:150! financial:61 stat:136. 561 opcodes. CATALOG 577! 8,212 LOC. 303ms. 570/570.","timestamp":1773905599465,"segment":0}
{"run":212,"commit":"6074078","metric":298,"metrics":{"h7_eval_ms":108},"status":"keep","description":"12 new tests: FIBONACCI/COLLATZ (sequences), DISTANCE2D/MANHATTAN/HYPOT3 (distance), CAGR/DOLLARDE (financial), TYPEOF2 (info). Tests: 570→582! 577 catalog. 561 opcodes. 298ms.","timestamp":1773905784292,"segment":0}
{"run":213,"commit":"10e5d66","metric":335,"metrics":{"h7_eval_ms":108},"status":"keep","description":"14-function batch: Number theory (ISPRIME/NEXTPRIME/PRIMECOUNT/TOTIENT/DIVISORS), Text (TEXTPADSTART/TEXTPADEND/TEXTWRAP/CHARCODE/FROMCHARCODE), Lookup (SEQUENCE2/LINSPACE), Info (CELLTYPE/CHECKSUM). math:155! text:89 lookup:40 info:77. 572 opcodes. CATALOG 591! 8,378 LOC. 335ms. 582/582.","timestamp":1773906053400,"segment":0}
{"run":214,"commit":"e78c7ff","metric":345,"metrics":{"h7_eval_ms":108},"status":"keep","description":"Fixed _OP pool missing entries for ISPRIME/NEXTPRIME/PRIMECOUNT/TOTIENT/DIVISORS/CHARCODE/FROMCHARCODE/CELLTYPE/CHECKSUM. Added 13 new tests. Tests: 582→595! 591 catalog. 572 opcodes. All green.","timestamp":1773906331334,"segment":0}
{"run":215,"commit":"77d84fd","metric":351,"metrics":{"h7_eval_ms":108},"status":"keep","description":"🎉 600 CATALOG MILESTONE! 9-function batch: Math (DIGSUM/DIGROOT/NTHROOT), Text distance (TEXTHAMMING/TEXTLEV), Info validators (ISALPHANUM/ISALPHA), Logic (MAJORITY), Stat (COEFVAR). math:158 stat:137 text:91 info:79 logic:28. 8,489 LOC. 351ms. 595/595.","timestamp":1773906455280,"segment":0}
{"run":216,"commit":"b406234","metric":331,"metrics":{"h7_eval_ms":108},"status":"keep","description":"9 more tests: DIGSUM/DIGROOT/NTHROOT (digits), TEXTHAMMING/TEXTLEV (string distance), ISALPHANUM/ISALPHA (validators). Tests: 595→604! 600 catalog. 331ms. All green.","timestamp":1773906492625,"segment":0}
{"run":217,"commit":"80dea81","metric":322,"metrics":{"h7_eval_ms":108},"status":"keep","description":"Re-baseline after context restart. 600 catalog, 581 opcodes, 604 tests, 8489 LOC. 322ms.","timestamp":1773906593795,"segment":0}
{"run":218,"commit":"658c0dd","metric":370,"metrics":{"h7_eval_ms":108},"status":"keep","description":"22-function batch: Geometry (POLYGONAREA/CIRCLEAREA/SPHEREVOL/CYLINDERVOL), Stat (KURTOSIS/SKEWNESS/GEOMEAN2/HARMEAN2), Math (LCMM/GCDM), Text (TEXTSIM/TEXTZALGO/TEXTASCII/TEXTSLUG), Financial (WACC/PAYBACK/ROI), Info (ISNUMSTR/TEXTENTROPY), Logic (ALL2/ANY2/NONE2). CATALOG 622! 603 opcodes! math:164 stat:141 text:95 info:81 financial:64 logic:31. 8,738 LOC. 370ms.","timestamp":1773906772517,"segment":0}
{"run":219,"commit":"d36425f","metric":369,"metrics":{"h7_eval_ms":108},"status":"keep","description":"Fixed asBool→inline truthy for ALL_N/ANY_N/NONE_N. Fixed N_VARIANTS for LCMM/GCDM/KURTOSIS/SKEWNESS/GEOMEAN2/HARMEAN2/MAJORITY/COEFVAR. 17 new tests: geometry, stat, text, financial, logic. Tests: 604→621! 622 catalog. All green.","timestamp":1773907132722,"segment":0}
{"run":220,"commit":"71efb2d","metric":388,"metrics":{"h7_eval_ms":108},"status":"keep","description":"18-function batch: Trig (DEG2RAD/RAD2DEG/SINC/ATAN22), Combinatorics (BINOMCOEF/CATALAN/TRIANGLENUM), Text (TEXTEMOJI/TEXTSTRIP/TEXTNORM/TEXTMORSE), Financial (BREAKEVEN/PROFITMARGIN/MARKUP), Info (ISUPPER/ISLOWER/ISPALINDROME), Lookup (REPEAT2). CATALOG 640! 620 opcodes. math:171 text:99 info:84 financial:67. 8,903 LOC. 388ms. 621/621.","timestamp":1773907316636,"segment":0}
{"run":221,"commit":"3f0b498","metric":351,"metrics":{"h7_eval_ms":108},"status":"keep","description":"15 new tests: DEG2RAD/RAD2DEG/SINC (trig), BINOMCOEF/CATALAN/TRIANGLENUM (combinatorics), TEXTSTRIP/TEXTNORM (text), PROFITMARGIN/MARKUP/BREAKEVEN (financial), ISUPPER/ISLOWER/ISPALINDROME (info). Tests: 621→636! 640 catalog. 351ms.","timestamp":1773907377758,"segment":0}
{"run":222,"commit":"d9bb1ce","metric":370,"metrics":{"h7_eval_ms":108},"status":"keep","description":"🎉 650 CATALOG MILESTONE! 10-function batch: Figurate numbers (PENTAGONAL/HEXAGONAL/TETRAHEDRAL/PYRAMIDAL), Math (STIRLING/ISPERFECT/ISHARSHAD), Geometry (CONEVOL), Text compression (TEXTRLE/TEXTRLD). math:179! text:101! 9,003 LOC. 370ms. 636/636.","timestamp":1773907529680,"segment":0}
{"run":223,"commit":"d38c0e7","metric":364,"metrics":{"h7_eval_ms":108},"status":"keep","description":"10 new tests: PENTAGONAL/HEXAGONAL/TETRAHEDRAL/PYRAMIDAL (figurate), ISPERFECT/ISHARSHAD (number theory), TEXTRLE/TEXTRLD (compression), CONEVOL (geometry). Tests: 636→646! 650 catalog. 364ms.","timestamp":1773907599851,"segment":0}
{"run":224,"commit":"fa4ca0a","metric":389,"metrics":{"h7_eval_ms":108},"status":"keep","description":"15-function batch: Waves (SAWTOOTH/SQUAREWAVE/TRIANGLEWAVE), Math (AGM/LOGISTIC/GAMMA2), Ciphers (TEXTROT13/TEXTCAESAR), Text (TEXTFREQ), Info (ISASCII/ISPRINTABLE/ISWHITESPACE), Financial (SIMPLEINT/COMPOUNDINT/DEPRECIATION). CATALOG 665! math:185 text:104 financial:70. 9,161 LOC. 389ms. 646/646.","timestamp":1773907823413,"segment":0}
{"run":225,"commit":"5aa02a0","metric":383,"metrics":{"h7_eval_ms":108},"status":"keep","description":"10 new tests: SQUAREWAVE (waves), AGM (math), GAMMA2 (Lanczos), TEXTROT13/TEXTCAESAR (ciphers), ISASCII/ISPRINTABLE (info), SIMPLEINT/DEPRECIATION (financial). Tests: 646→656! 665 catalog. 383ms.","timestamp":1773907866339,"segment":0}
{"run":226,"commit":"4235451","metric":368,"metrics":{"h7_eval_ms":108},"status":"keep","description":"14-function batch: Sequences (LUCAS/BELL), Bitwise (INTLOG2/INTLOG10/BITLEN), Text (TEXTREPEAT/TEXTNTH/TEXTUNIQUE/TEXTDISTINCT), Lookup (COUNTIF2), Info (CHARCOUNT/ISEMPTYTEXT), Financial (RULEOF72/PRESENTVAL). CATALOG 679! math:190 text:108 info:89 financial:72. 9,314 LOC. 368ms. 656/656.","timestamp":1773908042387,"segment":0}
{"run":227,"commit":"337f33a","metric":367,"metrics":{"h7_eval_ms":108},"status":"keep","description":"12 new tests: LUCAS/BELL (sequences), INTLOG2/INTLOG10/BITLEN (bit ops), TEXTREPEAT/TEXTNTH/TEXTUNIQUE/TEXTDISTINCT (text), CHARCOUNT/ISEMPTYTEXT (info), RULEOF72 (financial). Tests: 656→668! 679 catalog. 367ms.","timestamp":1773908101603,"segment":0}
{"run":228,"commit":"6ef3409","metric":363,"metrics":{"h7_eval_ms":108},"status":"keep","description":"🏆 700 CATALOG MILESTONE! 21-function batch: Constants (GOLDEN/EULER2/TAU), Math (CUBEROOT/WRAP/REMAP/ABUNDANCY/DIGITCOUNT), Text (TEXTBASE64/TEXTFROMBASE64/TEXTPREFIX/TEXTSUFFIX), Stat (RMS/RANGE2/IQR/MAPE), Info (ISODD2/ISEVEN2/ISZERO), Financial (ANNUITY/FVANNUITY). math:198 stat:145 text:112 info:92 financial:74 lookup:42 logic:31. 9,501 LOC. 363ms. 668/668.","timestamp":1773908457813,"segment":0}
{"run":229,"commit":"680-tes","metric":387,"metrics":{"h7_eval_ms":108},"status":"keep","description":"12 new tests: GOLDEN/TAU (constants), CUBEROOT/DIGITCOUNT (math), TEXTPREFIX/TEXTSUFFIX/TEXTROT13 (text), RMS/RANGE2 (stat), ISZERO (info), ANNUITY (financial). Tests: 668→680! 700 catalog. 387ms.","timestamp":1773908517381,"segment":0}
{"run":230,"commit":"f8907b9","metric":398,"metrics":{"h7_eval_ms":108},"status":"discard","description":"Re-baseline after session restart. 700 catalog, 680 tests, 9,501 LOC. 398ms (warm up variance).","timestamp":1773908636373,"segment":0}
{"run":231,"commit":"b50a9bf","metric":401,"metrics":{"h7_eval_ms":108},"status":"keep","description":"19-function batch (all verified unique): Math (CHEBYSHEV/NEXTODD/NEXTEVEN), Conversions (TOROMAN/FROMROMAN/TOORDINAL), Text (TEXTHEX/TEXTFROMHEX/TEXTDEDUPE/TEXTLINES/TEXTPASCALCASE), Stat (WMEAN/GINI2), Info (ISPOWEROFTWO/ISPRIMEFAST), Financial (SHARPE/SORTINO/EMAVG/SMAVG). CATALOG 719! math:201 text:120 stat:147 financial:78. 9,668 LOC. 401ms. 680/680.","timestamp":1773909097026,"segment":0}
{"run":232,"commit":"1963228","metric":358,"metrics":{"h7_eval_ms":108},"status":"keep","description":"14 new tests: TOROMAN/FROMROMAN (Roman numerals + round-trip), TOORDINAL, TEXTHEX/TEXTFROMHEX, TEXTDEDUPE/TEXTPASCALCASE, ISPOWEROFTWO/ISPRIMEFAST, SHARPE, CHEBYSHEV. Tests: 680→694! 719 catalog. 358ms.","timestamp":1773909143139,"segment":0}
{"run":233,"commit":"4799302","metric":286,"metrics":{"h7_eval_ms":108},"status":"keep","description":"🏆🏆 750 CATALOG MILESTONE! 31-function batch: Number theory (COPRIME/COLLATZ/PREVPRIME/TOTIENT2/FIBONACCI2/MOTZKIN/DERANGEMENT/HARMONIC2), Text (TEXTPAD/TEXTMASK/WORDSCOUNT/TEXTOBFUSCATE/TEXTCOUNT2/TEXTSHUFFLE/TEXTPASCALCASE), Info (ISLEAPYEAR/WEEKOFYEAR/ISWEEKEND/QUARTERNO/SEMESTERNO/TEXTISURL/TEXTISEMAIL/ISFIBBISH/ISPOWEROFTWO/ISPRIMEFAST), Financial (EFFECTRATE/NOMRATE/NPER2/RATE2), Stat (AVEDEV2/COVAR2/CORREL2/COSSIM/WMEAN/GINI2), Logic (ISCOPRIMEALL). math:209 stat:151 text:126 info:102 financial:82 logic:32. 9,953 LOC. 286ms! 694/694.","timestamp":1773909406411,"segment":0}
{"run":234,"commit":"7c6e659","metric":305,"metrics":{"h7_eval_ms":108},"status":"keep","description":"20 new tests for 750 batch: COPRIME, COLLATZ, PREVPRIME, TOTIENT2, FIBONACCI2, DERANGEMENT, ISFIBBISH, TEXTMASK, TEXTOBFUSCATE, TEXTCOUNT2, WORDSCOUNT, TEXTISEMAIL, TEXTISURL, ISLEAPYEAR, QUARTERNO, SEMESTERNO, EFFECTRATE. Tests: 694→714! 750 catalog. 305ms.","timestamp":1773909491447,"segment":0}
{"run":235,"commit":"780fb78","metric":289,"metrics":{"h7_eval_ms":108},"status":"keep","description":"🏆🏆🏆 800 CATALOG MILESTONE! 50-function batch: Lookup (BINSEARCH/INDEXMATCH/LASTINDEXOF/FINDALL/COUNTUNIQ/ARRAYCONTAINS/ARRAYPOS/FLATTEN2 → 50), Logic (IFF/SWITCH2/XORALL/NANDALL/NORALL/COALESCE2/UNLESS → 39), Math (SECANT/COSECANT/VERSINE/HAVERSINE/EXSECANT/LEMNISCATE/AGM2/POWMOD → 217), Stat (MAD2/ZSCORE2/TSTAT/FSTAT/CHISQSTAT/SEM/POOLEDVAR → 158), Text (TEXTCOUNTCHAR/TEXTZFILL/TEXTLPAD/TEXTRPAD/TEXTABBREV/TEXTWORDFREQ/TEXTSANITIZE/TEXTMIRROR → 134), Info (TYPEOF3/ISBLANK2/ISTRUTHY/ISFALSY/ISFRACTION/ISDIVISIBLE → 108), Financial (PVANNUITY/ANNUITYPMT/BONDPRICE/BONDYIELD/TBILL2/MACAULAY → 88). 10,360 LOC. 289ms! 714/714.","timestamp":1773909795230,"segment":0}
{"run":236,"commit":"201f2f2","metric":369,"metrics":{"h7_eval_ms":108},"status":"keep","description":"30 new tests for 800 batch: COUNTUNIQ/ARRAYCONTAINS/ARRAYPOS/FINDALL (lookup), IFF/XORALL/NANDALL/NORALL/UNLESS (logic), VERSINE/HAVERSINE/POWMOD (math), FSTAT/CHISQSTAT (stat), TEXTZFILL/TEXTABBREV/TEXTMIRROR/TEXTCOUNTCHAR (text), ISTRUTHY/ISFALSY/ISFRACTION/ISDIVISIBLE (info), TBILL2 (financial). Fixed N_VARIANTS wiring for variadic functions. Tests: 714→744! 800 catalog. 369ms.","timestamp":1773910101004,"segment":0}
{"run":237,"commit":"1bc7ceb","metric":365,"metrics":{"h7_eval_ms":108},"status":"keep","description":"🏆🏆🏆 850 CATALOG MILESTONE! 50-function batch: Lookup (DISTINCT/ARRAYSLICE/ARRAYJOIN/ARRAYREVERSE/ARRAYFLATTEN/ARRAYZIP/ARRAYMIN/ARRAYMAX/ARRAYSUM/ARRAYAVG → 60), Logic (NIFF/SWITCHIF/COND/ALLEQUAL/ANYGT/ANYLT/ANYNE/ISALL/ISANY/ISNONE → 49), Volatile (RANDNORM/RANDEXP/RANDINT/COINFLIP → 10), Math (GUDERMANN/INVERSEGUD/LANCZOS/DIGAMMA/POLYGAMMA/ZETA2/BETAFN/POCHHAMMER → 225), Stat (ENTROPY2/GINICOEF/MOMENT/CMOMENT/ZSCORE3/PERCENTILE2 → 164), Text (TEXTFORMAT/TEXTJUSTIFY/TEXTMASK2/TEXTHASH/TEXTREPLACE2/TEXTFILL → 140), Financial (CAGR2/DRAWDOWN/CALMAR/TREYNOR → 92), Info (ISFINITE2/ISWHOLE → 110). 10,687 LOC. 365ms. 744/744.","timestamp":1773910557571,"segment":0}
{"run":238,"commit":"f2887cc","metric":351,"metrics":{"h7_eval_ms":108},"status":"keep","description":"850 batch tests: 28 new tests covering DISTINCT/ARRAYMIN/ARRAYMAX/ARRAYSUM/ARRAYAVG/ARRAYJOIN (lookup), ALLEQUAL/ISALL/ISANY/ISNONE (logic), GUDERMANN/POCHHAMMER (math), GINICOEF/ENTROPY2/MOMENT (stat), TEXTHASH/TEXTMASK2/TEXTJUSTIFY (text), DRAWDOWN/CALMAR/TREYNOR (financial), ISFINITE2/ISWHOLE (info). Fixed classifyToken wiring + VMValue handling (binop/unop/vmDisplay). Tests: 744→772! 850 catalog. 10,713 LOC. 351ms.","timestamp":1773912247096,"segment":0}
{"run":239,"commit":"7b0191b","metric":373,"metrics":{"h7_eval_ms":108},"status":"keep","description":"🏆🏆🏆🏆 900 CATALOG MILESTONE! 50-function batch: Logic (EQUIV/ONEOF/FIRSTTRUTHY/LASTTRUTHY/COUNTIF3/WHICHMAX/WHICHMIN/THRESHOLD/TOGGLE/SATURATE/DEADBAND → 60), Volatile (RANDPERM/RANDCHOICE/DICE/UUID4 → 14), Lookup (ENUMERATE/COUNTVALS/FIRSTNONZERO/LASTNONZERO/NTHLARGEST → 65), Financial (AMORT/DAILYRETURN/VOLANNUAL/MAXDD/INFORMRATIO/JENSENALPHA → 98), Math (LAGUERRE/HERMITE/LEGENDRE/CHEBYSHEV2/FRESNEL_S/FRESNEL_C/AIRY/DAWSON → 233), Stat (TRIMMEDMEAN/WINSOREDMEAN/MIDRANGE/MIDHINGE/MEANDEV/ROOTMEANSQERR → 170), Text (TEXTWORDWRAP/TEXTCOLUMNS/TEXTTAB/TEXTBOXIFY/TEXTCOUNTWORDS/TEXTFIRSTWORD → 146), Info (ISNUMTYPE/ISSTRTYPE/ISBOOLTYPE/ISERRORTYPE → 114). 10,935 LOC. 373ms. 772/772.","timestamp":1773912854376,"segment":0}
{"run":240,"commit":"4dac69f","metric":374,"metrics":{"h7_eval_ms":108},"status":"keep","description":"28 new tests for 900 batch: EQUIV/TOGGLE/SATURATE/THRESHOLD/WHICHMAX/WHICHMIN/FIRSTTRUTHY/COUNTIF3 (logic), NTHLARGEST/FIRSTNONZERO/ENUMERATE (lookup), LEGENDRE/HERMITE/LAGUERRE (math), MIDRANGE/MEANDEV (stat), DAILYRETURN/INFORMRATIO (financial), TEXTCOUNTWORDS/TEXTFIRSTWORD (text), ISNUMTYPE/ISBOOLTYPE (info). Tests: 772→800! 900 catalog. 10,935 LOC. 374ms.","timestamp":1773913049100,"segment":0}
{"run":241,"commit":"eb5d532","metric":343,"metrics":{"h7_eval_ms":108},"status":"keep","description":"🏆🏆🏆🏆🏆 950 CATALOG! 50-function batch: Logic (IFPOS/IFNEG/IFZERO/IFEVEN/IFODD/GATE/LATCH/DEBOUNCE/MUXSEL/DEMUX → 70), Volatile (RANDSIGN/RANDBOOL → 16), Lookup (NTHSMALLEST/ARGMAX/ARGMIN/DEDUP/INTERLEAVE → 70), Financial (COUPON/ACCRUEDINT/PARVALUE/HOLDINGRETURN/TIMEDWRETURN/DIVYIELD → 104), Math (SININT/COSINT/EXPINT/LOGINT/DILOG/CLAUSEN/ELLIPK/ELLIPE → 241), Stat (QUADMEAN/POWMEAN/LEHMER/ENTROPY3/RELENTROPY/MUTUALINFO/CROSSENTROPY → 177), Text (TEXTINITCAP/TEXTSNIP/TEXTUNQUOTE/TEXTQUOTE/TEXTDOTS/TEXTBULLET → 152), Info (ISNUMERIC/ISTEXT2/ISERR2/ISBLANK3/ISNOTEMPTY/TYPESTR → 120). 11,150 LOC. 343ms. 800/800.","timestamp":1773913859055,"segment":0}
{"run":242,"commit":"ec46d02","metric":302,"metrics":{"h7_eval_ms":108},"status":"keep","description":"🏆🏆🏆🏆🏆🏆 1000 CATALOG MILESTONE!!! 50-function batch: Math (JACOBI/BESSEL_I0/BESSEL_J0/BESSEL_K0/STRUVE/WEBER/HURWITZ/POLYLOG/LAMBERTW/AGMFN → 251), Stat (CONTRAHARMONIC/HERONIAN/LOGTRANSFORM/ZSCORENORM/MAD3/BIWEIGHT/HUBER/WINVAR → 185), Text (TEXTCENTER2/TEXTINDENT/TEXTHEADER/TEXTFOOTER/TEXTCOUNTLINES/TEXTISEMPTY/TEXTCOALESCE/TEXTTAG → 160), Info (ISPOS/ISNEG2/ISNONZERO/ISINRANGE/SIGNOF/MAGNITUDE → 126), Financial (COSTBASIS/UNREALIZEDPNL/REALIZEDPNL/DOLLARVAL/BASISPOINTS/TICKVALUE → 110), Logic (MAJORITY2/UNANIMOUS/QUORUM/VETO/PRIORITYSEL/FALLBACK → 76), Lookup (RANK2/DENSERANK/NTILE/ROWNUMBER → 74), Volatile (RANDWEIGHTED/RANDSAMPLE → 18). 11,369 LOC. 302ms! 800/800 tests.","timestamp":1773914061206,"segment":0}
{"run":243,"commit":"84d53ac","metric":291,"metrics":{"h7_eval_ms":108},"status":"keep","description":"38 new tests for 950+1000 batches: IFPOS/IFNEG/IFZERO/GATE/NTHSMALLEST/DEDUP/QUADMEAN/TEXTINITCAP/TEXTBULLET/ISNUMERIC/TYPESTR/COUPON/DIVYIELD (950), LAMBERTW/AGMFN/BESSEL_J0/BESSEL_I0/ISPOS/ISNEG2/ISNONZERO/SIGNOF/MAGNITUDE/BASISPOINTS/COSTBASIS/MAJORITY2/UNANIMOUS/RANK2/TEXTISEMPTY/TEXTHEADER (1000). Tests: 800→838! 1000 CATALOG. 11,369 LOC. 291ms.","timestamp":1773914120642,"segment":0}
{"run":244,"commit":"d72682c","metric":367,"metrics":{"h7_eval_ms":108},"status":"keep","description":"Catalog deduplication: removed 58 duplicate entries accumulated across batches. True unique catalog: 942 (was reporting 1000 with duplicates). Tests: 659 stack-vm + 80 effect-vm all passing. Clean baseline for honest 1000 push.","timestamp":1773915045232,"segment":0}
{"run":245,"commit":"eb33e9b","metric":375,"metrics":{"h7_eval_ms":108},"status":"keep","description":"HONEST 1000 CATALOG! Deduped 58 phantom entries, added 59 genuinely new functions: activation fns (LOGISTIC2/GELU/MISH/SWISH/LEAKYRELU/SOFTMAX2/INVERSESQRT/PRELU/CELU/SOFTSIGN/BENTID/SQUAREPLUS), stat (SAMPLEVAR/POPVAR/SAMPLESTD/POPSTD/RANGESTAT/SUMPRODUCT2/SUMSQDIFF/AVGDEV2/RMSVAL/GEOSTD), text (TEXTZIP/TEXTREPEATN/TEXTISALPHA/TEXTISDIGIT/TEXTISALNUM/TEXTISSPACE/TEXTTITLE2/TEXTSWAP/TEXTBASE64/ISPALINDROME/LETTERCOUNT), financial (ANNUALRATE/EFFECTIVERATE/NOMINALRATE/FUTUREVALUE/PRESVALUE/ANNUITYDUE/SINKINGFUND), logic (IMPLIESSTRICT/XNOR2/HALFADD/FULLADD/COMPARE3/BETWEEN2), lookup (BINCOUNT/HISTOGRAM/MODECOUNT), volatile (RANDLAPLACE/RANDLOGISTIC). 11,568 LOC. 1000 unique. 838 tests.","timestamp":1773916120359,"segment":0}
{"run":246,"commit":"7e73520","metric":372,"metrics":{"h7_eval_ms":108},"status":"keep","description":"24 new tests for honest-1000 batch: GELU/MISH/SWISH/SOFTSIGN/LOGISTIC2/RIEMANN (math), SAMPLEVAR/POPVAR/RANGESTAT/RMSVAL (stat), EFFECTIVERATE/BASISPOINTS (financial), COMPARE3/HALFADD/XNOR2 (logic), TEXTISALPHA/TEXTISDIGIT/TEXTSWAP (text), ISPALINDROME/PARITY/ISNAT (info). Tests: 838→862! 1000 unique catalog. 11,568 LOC.","timestamp":1773916262237,"segment":0}
{"run":247,"commit":"553bcdc","metric":363,"metrics":{"h7_eval_ms":108},"status":"keep","description":"1047 UNIQUE CATALOG! 47 new verified-unique functions: waveforms (ARCTANH2/ARCCOTH/SIGMOID2/GAUSSIAN2/RAMP/HEAVISIDE/BOXCAR/TRIANGLE2/SAWTOOTH2), windowing (WELCH/HAMMING/HANNING/BLACKMAN/KAISER/TUKEYWIN), ML metrics (GINIIMPURITY/INFOGAIN), text formatting (TEXTWRAP2/TEXTPADCENTER/TEXTDELIMIT/TEXTENCLOSE/TEXTSURROUND/TEXTCHOP/TEXTELLIPSIS/TEXTCENSOR), number theory (ISCUBE/ISCOPRIME/ISTRIANGULAR/ISPENTAGONAL/ISHEXAGONAL/ISHARSHAD), financial (SIMPLEINTEREST/COMPOUND2/RULE72/RULE70/MARKUPRATE/MARGINRATE), logic gates (NOR2/NAND2/EQUIV2/PEIRCE/SHEFFER/CONSENSUS), lookup (BSEARCH2/UNIQUE2/COUNTDIST/TOPK/BOTTOMK). 11,765 LOC. 862 tests.","timestamp":1773916945007,"segment":0}
{"run":248,"commit":"2aac3a0","metric":386,"metrics":{"h7_eval_ms":108},"status":"keep","description":"19 new tests for 1047 batch: HEAVISIDE/RAMP/GAUSSIAN2/SAWTOOTH2 (waveforms), ISCUBE/ISTRIANGULAR/ISHARSHAD (number theory), RULE72 (financial), NOR2/NAND2 (logic gates), TOPK/BOTTOMK/UNIQUE2 (lookup), MARKUPRATE/MARGINRATE (financial). Tests: 862→881! 1047 unique catalog. 11,765 LOC.","timestamp":1773917072324,"segment":0}
