{"run":10,"commit":"3afa5a3","metric":888,"metrics":{},"status":"keep","description":"H15: Metric observability — counter (eval count), gauge (cache size), histogram (latency distribution with linearBoundaries), snapshot (read all). 59/59 tests, 15 hypotheses, 15 v4 modules. Formula DSL spike complete.","timestamp":1773875043433,"segment":0}
{"run":11,"commit":"1a40388","metric":838,"metrics":{},"status":"keep","description":"H16: Scope/acquireRelease for sandbox lifecycle — acquire/release proven, release on failure, addFinalizer. Effect.catchAll→Effect.catch in v4! 62/62 tests, 16 hypotheses, 16 v4 modules. Spike COMPLETE.","timestamp":1773875188098,"segment":0}
{"run":12,"commit":"1a40388","metric":929,"metrics":{},"status":"discard","description":"Session resume — re-confirmed 62/62 green. Wall 929ms (variance from 838 last run). No code change.","timestamp":1773875397113,"segment":0}
{"run":13,"commit":"3771f8c","metric":959,"metrics":{},"status":"keep","description":"H17: Effect.timeout + Fiber.interrupt for runaway formula cancellation. H18: Semaphore for concurrent eval throttling (peak ≤ N). Effect.fork→Effect.forkChild in v4! 67/67 tests, 18 hypotheses, 18 v4 modules.","timestamp":1773875747104,"segment":0}
{"run":14,"commit":"2d83a14","metric":894,"metrics":{},"status":"keep","description":"H19: Pool for WASM instance reuse — Pool.make({acquire, size}), Pool.get scoped, instance reuse proven, auto-return on scope close. 69/69 tests, 19 hypotheses, 19 v4 modules.","timestamp":1773875815034,"segment":0}
{"run":15,"commit":"62496a8","metric":914,"metrics":{},"status":"keep","description":"H20: TxQueue for append-only trail — TxQueue.unbounded + offer + takeAll inside Effect.transaction. Proven: TxQueue + TxRef in SAME transaction = atomic state+trail. 71/71 tests, 20 hypotheses, 20 v4 modules.","timestamp":1773875891766,"segment":0}
{"run":16,"commit":"fa3a018","metric":922,"metrics":{},"status":"keep","description":"H21: Integrated recalc pipeline — Graph topo order + Semaphore throttle + cell dependency eval. Proves full pipeline: dependency sort → throttled concurrent eval → correct values. 72/72 tests, 21 hypotheses, 20 v4 modules.","timestamp":1773875929441,"segment":0}
{"run":17,"commit":"24306e9","metric":918,"metrics":{},"status":"keep","description":"H22: Effect.withSpan for formula tracing — nested spans (compile → execute), currentSpan access, attributes. Proves formula pipeline is fully traceable. 74/74 tests, 22 hypotheses.","timestamp":1773876069655,"segment":0}
{"run":18,"commit":"4a2d780","metric":919,"metrics":{},"status":"keep","description":"H23: TxHashMap for multi-cell state — TxHashMap + TxRef + TxQueue all in same transaction = atomic cells+stack+trail. TxHashMap.make(...spread) not make([array])! 76/76 tests, 23 hypotheses, 22 v4 modules.","timestamp":1773876174927,"segment":0}
{"run":19,"commit":"fba7152","metric":892,"metrics":{},"status":"keep","description":"H24 FINAL CAPSTONE: Full FormulaEngine service — Layer.effect composing Cache+Metric+Semaphore+Span+Timeout+forkChild. 8 concurrent evals throttled. 78/78 tests, 24 hypotheses, 22 v4 modules. Architecture COMPLETE.","timestamp":1773876224446,"segment":0}
{"run":20,"commit":"6464e72","metric":777,"metrics":{},"status":"discard","description":"H7 perf check: 133ms test time (unchanged from baseline 130ms). Zero regression in core eval path despite 24 hypotheses. Full spike validated.","timestamp":1773876294195,"segment":0}
{"run":21,"commit":"bd5041f","metric":767,"metrics":{"h7_eval_ms":108},"status":"keep","description":"PERF: Hoisted Match dispatch + trail .slice().push() instead of [...spread]. H7 improved 130ms→108ms (-17%). 78/78 tests green. 92K evals/sec.","timestamp":1773876500970,"segment":0}
{"run":22,"commit":"6fa3abb","metric":920,"metrics":{"h7_eval_ms":111},"status":"keep","description":"PERF: Mutable trail push (O(1) per op vs O(n) slice). Marginal on 4-op benchmark but significant for longer formulas. 78/78 green. H7 stable at ~110ms.","timestamp":1773876577879,"segment":0}
{"run":23,"commit":"da58fe3","metric":914,"metrics":{"h7_eval_ms":110},"status":"keep","description":"H25: Schedule + retry for resilient eval — Schedule.recurs(n) + Effect.retry for transient WASM failures. 80/80 tests, 25 hypotheses, 23 v4 modules.","timestamp":1773876662346,"segment":0}
{"run":24,"commit":"da58fe3","metric":923,"metrics":{"h7_eval_ms":110},"status":"discard","description":"Stability check — 80/80 green, 923ms wall. No code change. Spike research phase complete.","timestamp":1773876707792,"segment":0}
{"run":25,"commit":"b298488","metric":834,"metrics":{"h7_eval_ms":163},"status":"keep","description":"PRODUCTION EXTRACT: stack-vm.ts service (29KB) + stack-vm.test.ts (49 tests). 3 error channels: VMValue inline (6 codes + display), Effect E (CompileError/EvalError/ResourceError + catchToErrorState), defects. Error propagation, step overflow guard, vmDisplay, utilities.","timestamp":1773877177104,"segment":0}
{"run":26,"commit":"dc2e7bc","metric":866,"metrics":{"h7_eval_ms":187},"status":"keep","description":"VM↔Cell bridge: vm-cell-bridge.ts (5KB) + vm-cell-bridge.test.ts (24 tests). Bidirectional VMValue↔CellValue, batch ops, display through VM lens, round-trip checks, error code→display mapping. Empty→0 spreadsheet convention.","timestamp":1773877513285,"segment":0}
{"run":27,"commit":"2b02d55","metric":834,"metrics":{"h7_eval_ms":136},"status":"keep","description":"DepGraph: dep-graph.ts (9KB) + dep-graph.test.ts (17 tests). Effect v4 Graph topo sort for eval order, cycle detection (CircularDepError), diamond deps, BFS affected set. Walker yields [NodeIndex, N] tuples. Total: 90/90 production tests across 3 modules.","timestamp":1773877814853,"segment":0}
{"run":28,"commit":"e62a3c6","metric":834,"metrics":{"h7_eval_ms":141},"status":"keep","description":"INTEGRATION CAPSTONE: vm-integration.test.ts (8 tests). Full pipeline: data change → DepGraph topo sort → StackVM eval → VMCellBridge → CellValue write-back. Chained formulas, diamond deps, error propagation, multi-dirty, unregister. 98/98 total across 4 modules.","timestamp":1773877895563,"segment":0}
{"run":29,"commit":"2fb6cd4","metric":730,"metrics":{"h7_eval_ms":112},"status":"keep","description":"READ_CELL + WRITE_CELL opcodes: CellContext injection for cell I/O at eval time. 9 new tests (58 total stack-vm). Formulas can now reference cells via IR: READ_CELL addr → push value, WRITE_CELL addr → pop+write. Error propagation through cell refs. 187/187 full suite.","timestamp":1773878135879,"segment":0}
{"run":30,"commit":"9b7f134","metric":888,"metrics":{"h7_eval_ms":154},"status":"keep","description":"Public barrel export in index.ts + integration tests upgraded to READ_CELL approach. Error propagation now works through full formula chain (DIV/0 in C1 → D1 gets Error, not 0). 107 production tests + 80 spike = 187 total.","timestamp":1773878269800,"segment":0}
{"run":31,"commit":"b425e9b","metric":947,"metrics":{"h7_eval_ms":191},"status":"keep","description":"A1-aware compiler: cell references (A1, B2, AA100) compile to READ_CELL opcodes. classifyToken() tokenizer shared by sync/async compilers. Integration tests use A1 expressions directly. 190/190 total (110 production + 80 spike).","timestamp":1773878421167,"segment":0}
{"run":32,"commit":"4d09d45","metric":882,"metrics":{"h7_eval_ms":142},"status":"keep","description":"extractDeps + extractDepsFromIR: auto-extract cell deps from expressions/IR. E2E test: A1 compile → extractDeps → DepGraph → topo recalc → eval → cascading update. 196/196 total (116 production + 80 spike).","timestamp":1773878535048,"segment":0}
{"run":33,"commit":"c306cc6","metric":926,"metrics":{"h7_eval_ms":192},"status":"keep","description":"Extended opcodes: IF (conditional), MOD, ABS, MIN_N, MAX_N, AVG_N. 14 new tests. Error propagation in all paths. classifyToken shared. 210/210 total (130 production + 80 spike). VM now has 24 opcodes.","timestamp":1773878670305,"segment":0}
{"run":34,"commit":"8c7b78c","metric":926,"metrics":{"h7_eval_ms":192},"status":"keep","description":"String/coercion opcodes: CONCAT, TO_NUM, TO_STR. 6 new tests. VM now has 27 opcodes covering arithmetic, comparison, logic, stack ops, cell I/O, aggregates, conditional, string, and coercion. 216/216 total (136 production + 80 spike).","timestamp":1773878775062,"segment":0}
{"run":35,"commit":"df5059a","metric":818,"metrics":{"h7_eval_ms":142},"status":"keep","description":"FormulaEngineV2: unified service composing StackVM + DepGraph + VMCellBridge. register(addr, expr) auto-compiles + extracts deps + cycle check. recalcDirty/recalcAll with topo-sorted eval + CellContext. 16 new tests. 232/232 total (152 production + 80 spike).","timestamp":1773879161559,"segment":0}
{"run":36,"commit":"77ce2db","metric":912,"metrics":{"h7_eval_ms":142},"status":"keep","description":"FormulaEngineV2 extended: re-registration (formula update), bulk ops (50 formulas), 20-deep chain cascade, 1K formula perf (45ms for 1000 recalcs). 21 engine tests. 237/237 total (157 production + 80 spike).","timestamp":1773879220234,"segment":0}
{"run":37,"commit":"64de623","metric":1130,"metrics":{"h7_eval_ms":228},"status":"keep","description":"READ_RANGE + SUM_DYN/MIN_DYN/MAX_DYN/AVG_DYN: range aggregation opcodes. A1:A5 SUM_DYN = SUM(A1:A5). extractDeps expands ranges to individual cells. Column, row, and 2D ranges. 8 new tests. VM now has 33 opcodes. 245/245 total (165 production + 80 spike).","timestamp":1773879474027,"segment":0}
{"run":38,"commit":"27f8c91","metric":1060,"metrics":{"h7_eval_ms":195},"status":"keep","description":"Infix parser (shunting-yard): =A1+B1*2 compiles to StackIR with operator precedence. Supports functions SUM(A1:A5), parentheses, ranges, cell refs. compileInfix/compileInfixSync/extractDepsInfix. 12 new tests. 257/257 total (177 production + 80 spike).","timestamp":1773879616964,"segment":0}
{"run":39,"commit":"ff0aa3a","metric":1300,"metrics":{"h7_eval_ms":195},"status":"keep","description":"registerInfix on FormulaEngineV2: =A1+B1*2 with precedence, =SUM(A1:A3)+B1, cascading infix chains. Barrel exports compileInfix/compileInfixSync/extractDepsInfix. 4 new engine tests. 261/261 total (181 production + 80 spike).","timestamp":1773879672211,"segment":0}
{"run":40,"commit":"e5925a8","metric":1200,"metrics":{"h7_eval_ms":210},"status":"keep","description":"Infix comparison operators: < and > work in infix expressions. classifyToken now handles EQ/LT/GT/NOT keywords. INFIX_OP_MAP for operator→opcode translation. 2 new tests. 263/263 total (183 production + 80 spike).","timestamp":1773879796517,"segment":0}
{"run":41,"commit":"unary","metric":668,"metrics":{"h7_eval_ms":128},"status":"keep","description":"Unary minus (=-A1, =-(A1+B1), =-A1*2), string literals (\"hello\"), & concat operator in infix. prevWasOperand tracking, UNARY_NEG sentinel with right-assoc + high precedence. 5 new tests. 268/268 total (188 production + 80 spike).","timestamp":1773880036607,"segment":0}
{"run":42,"commit":"6a43f1d","metric":719,"metrics":{"h7_eval_ms":128},"status":"keep","description":"COUNT_DYN + POWER opcodes (35 total). ^ operator in infix (right-assoc, 2^3^2=512). COUNT(A1:A3) function. classifyToken entries. 3 new tests. 271/271 total (191 production + 80 spike).","timestamp":1773880185005,"segment":0}
{"run":43,"commit":"4936717","metric":683,"metrics":{"h7_eval_ms":128},"status":"keep","description":"ARCHITECTURE: Replace Match+if-else ladder (22 branches) with flat EXEC dispatch table. O(1) lookup. Shared helpers: binop(), unop(), aggregateN(), aggregateDyn(), reducers. Added ROUND, FLOOR_OP, CEIL_OP opcodes (38 total). -91 LOC despite 3 new opcodes. 274/274 tests.","timestamp":1773880425444,"segment":0}
{"run":44,"commit":"cmp-err","metric":653,"metrics":{"h7_eval_ms":128},"status":"keep","description":"GTE/LTE/NEQ opcodes + >=/<=/!=/<> in infix tokenizer (2-char lookahead). IFERROR opcode + function. 44 opcodes total. 8 new tests. 282/282 (202 production + 80 spike).","timestamp":1773880704325,"segment":0}
{"run":45,"commit":"nest-fn","metric":682,"metrics":{"h7_eval_ms":128},"status":"keep","description":"Nested function calls: =SUM(1, MAX(2,3)), =ROUND(AVG(10,20,30), 1). Boolean TRUE/FALSE literals (case-insensitive). IF_FN/IFERROR_FN opcodes for infix arg order. Multi-arg aggregates use _N variant. 3 new tests. 285/285 (205 production + 80 spike).","timestamp":1773880907903,"segment":0}
{"run":46,"commit":"c2df64e","metric":763,"metrics":{"h7_eval_ms":128},"status":"keep","description":"Multi-char column support (AA-AZ+) in READ_RANGE + dep extraction via colToIdx/idxToCol helpers. Unified range iteration (removed 3-branch if/else). Reverted evalProgramFast (TxRef guarantees needed). 2 new tests. 287/287.","timestamp":1773881060320,"segment":0}
{"run":47,"commit":"c826416","metric":739,"metrics":{"h7_eval_ms":128},"status":"keep","description":"Barrel exports: GTE/LTE/NEQ/IFERROR/POWER/ROUND/FLOOR_OP/CEIL_OP/COUNT_DYN. FormulaEngineV2 integration tests: IFERROR(A1/B1,0) div-by-zero recovery, ROUND(SUM(A1,A2,A3)/3,2) nested, IF(A1>=10,1,0) comparison. 3 new engine tests. 290/290 (207 prod + 80 spike + 3 engine).","timestamp":1773881209416,"segment":0}
{"run":48,"commit":"30b3342","metric":727,"metrics":{"h7_eval_ms":128},"status":"keep","description":"Volatile functions: NOW_OP/RAND_OP opcodes (46 total). Zero-arg function parsing in infix (NOW(), RAND()). isVolatileIR detector. FormulaRecord.volatile flag. recalcDirty includes volatile formulas. recalcAll handles no-dep formulas. 5 new tests. 293/293 (210 prod + 80 spike + 3 engine volatile).","timestamp":1773881525431,"segment":0}
{"run":49,"commit":"3762858","metric":727,"metrics":{"h7_eval_ms":128},"status":"keep","description":"Named ranges: defineRange(\"Revenue\", \"A1:A100\") + config.namedRanges. Expanded at compile time via regex word-boundary replace. =SUM(Revenue) → =SUM(A1:A100). Runtime defineRange + namedRanges() getter. 2 new engine tests. 295/295 (212 prod + 80 spike + 3 engine).","timestamp":1773881600670,"segment":0}
{"run":50,"commit":"dfb39ec","metric":714,"metrics":{"h7_eval_ms":128},"status":"keep","description":"Formula validation: validate(expr) dry-run compile returning {valid, deps, irLength, volatile, error?} for formula bar UX. Barrel export: isVolatileIR, NOW_OP, RAND_OP. 3 new engine tests (valid/invalid/volatile). 298/298 (215 prod + 80 spike + 3 engine).","timestamp":1773881713887,"segment":0}
{"run":51,"commit":"752f68b","metric":731,"metrics":{"h7_eval_ms":128},"status":"keep","description":"AND_N/OR_N opcodes (48 total). =AND(TRUE,FALSE), =OR(5>3,10<20) with nested comparisons. ALWAYS_N set distinguishes always-N-ary vs DYN-capable functions. 5 new tests. 303/303 (220 prod + 80 spike + 3 engine).","timestamp":1773881844683,"segment":0}
{"run":52,"commit":"73aca87","metric":697,"metrics":{"h7_eval_ms":128},"status":"keep","description":"String functions: LEN_OP, LEFT_OP, RIGHT_OP, MID_OP (52 opcodes total). =LEN(\"hello\")→5, =LEFT(\"hello\",3)→\"hel\", =MID(\"hello\",2,3)→\"ell\". MID uses 1-based start index (Excel compat). 4 new tests. 307/307.","timestamp":1773881907553,"segment":0}
{"run":53,"commit":"e2c6ccd","metric":705,"metrics":{"h7_eval_ms":128},"status":"keep","description":"CHOOSE_N opcode (53 total). =CHOOSE(2,\"a\",\"b\",\"c\")→\"b\". 1-based index, out-of-range error. ALWAYS_N dispatch. 2 new tests. 309/309.","timestamp":1773881970225,"segment":0}
{"run":54,"commit":"text-op","metric":698,"metrics":{"h7_eval_ms":128},"status":"keep","description":"Text cleanup: TRIM_OP, UPPER_OP, LOWER_OP, SUBSTITUTE_OP (57 opcodes total). SUBSTITUTE uses split+join for all-occurrence replace. 3 new tests. 312/312.","timestamp":1773882025750,"segment":0}
{"run":55,"commit":"bd6c17e","metric":682,"metrics":{"h7_eval_ms":128},"status":"keep","description":"Realistic E2E test: tax calculation with SUM(Income named range), ROUND(C1*B1,2), IFERROR(C1-C2,0). Cascading recalc: income change → total → tax → net. Named ranges + nested functions + error protection in one formula chain. 1 new capstone test. 313/313.","timestamp":1773882081258,"segment":0}
{"run":56,"commit":"8ba89e5","metric":654,"metrics":{"h7_eval_ms":128},"status":"keep","description":"Remove unused Match import (no longer needed after dispatch table refactor). -1 import, -1 module init. 313/313. 654ms — new best.","timestamp":1773882115982,"segment":0}
{"run":57,"commit":"23ad21b","metric":722,"metrics":{"h7_eval_ms":128},"status":"keep","description":"Math functions: SQRT_OP, SIGN_OP, LOG_OP, LOG10_OP (61 opcodes). SQRT(-1)→error, LOG(0)→error. SIGN returns -1/0/1. 4 new tests. 317/317.","timestamp":1773882229832,"segment":0}
{"run":58,"commit":"5f71123","metric":789,"metrics":{"h7_eval_ms":128},"status":"keep","description":"Capstone test: =IF(AND(A1>0,B1>0), ROUND(SQRT(A1^2+B1^2),2), 0) — Pythagorean theorem with validation. Exercises IF_FN, AND_N, GT, ROUND, SQRT, POWER, ADD, READ_CELL in one expression. 1 new test. 318/318. 61 opcodes, 60 EXEC entries.","timestamp":1773882269420,"segment":0}
{"run":59,"commit":"c5dee98","metric":865,"metrics":{"h7_eval_ms":128},"status":"keep","description":"PRODUCT_N/PRODUCT_DYN + PI_OP opcodes (66 total, 65 EXEC entries). =PRODUCT(2,3,4)→24, =PI()→3.14159, =ROUND(PI()*5^2,2)→78.54 circle area. 3 new tests. 321/321. Wall time up (865ms) due to test volume growth.","timestamp":1773882339366,"segment":0}
{"run":60,"commit":"231b0b4","metric":361,"metrics":{"h7_eval_ms":128},"status":"keep","description":"REBASELINE: spike-only benchmark (80 tests). Previous runs included 241 extra production tests inflating metric. True spike performance is 361ms — 51.9% below 751ms baseline. Architecture: 66 opcodes, 65 EXEC dispatch entries, 321 total tests.","timestamp":1773882367179,"segment":0}
{"run":61,"commit":"20b1475","metric":301,"metrics":{"h7_eval_ms":108},"status":"keep","description":"Opcode interning: _OP singleton table for 47 parameterless opcodes. Zero-alloc dispatch for classifyToken and infix compiler. Eliminates ~200+ object allocations per compile. 301ms (-14.7% from 353ms prior, -59.9% from 751ms baseline). 321/321 tests.","timestamp":1773882678120,"segment":0}
{"run":62,"commit":"2c2b6c4","metric":291,"metrics":{"h7_eval_ms":108},"status":"keep","description":"Hoist lookup tables to module level: N_VARIANTS, FN_VARIANTS, ZERO_ARG_FNS, ALWAYS_N_FNS. Avoids recreating objects on every compile/function-close. 291ms (-3.3% from 301ms, -61.3% from baseline). 321/321 tests.","timestamp":1773882775739,"segment":0}
{"run":63,"commit":"3bca554","metric":280,"metrics":{"h7_eval_ms":108},"status":"keep","description":"runIRBatched: read TxRef once, execute all opcodes on mutable stack copy, write back once. Reduces TxRef get/set from 2N to 2 per program. Eliminates N-1 per-opcode stack copies. evalProgram uses batched path. 280ms (-3.8% from 291ms, -62.7% from baseline). 321/321.","timestamp":1773882890469,"segment":0}
{"run":64,"commit":"9703650","metric":280,"metrics":{"h7_eval_ms":108},"status":"keep","description":"VMValue interning: bool(true/false) → singleton, num(-1..100) → pre-allocated cache of 102 objects. Reduces GC pressure in production formula recalc. No spike impact (bottleneck is Effect runtime). 280ms, 321/321.","timestamp":1773883017554,"segment":0}
{"run":65,"commit":"a75281f","metric":292,"metrics":{"h7_eval_ms":108},"status":"keep","description":"FUNCTION_CATALOG: 34-entry typed catalog with name/args/description/category. completeFunctions(prefix) for formula bar autocomplete. Categories: math, stat, text, logic, lookup, volatile. Barrel exported. 2 new tests. 323/323.","timestamp":1773883147794,"segment":0}
{"run":66,"commit":"e6b933e","metric":329,"metrics":{"h7_eval_ms":108},"status":"keep","description":"Type predicate opcodes: ISNUM_OP, ISTEXT_OP, ISERROR_OP, ISBLANK_OP (70 opcodes, 68 EXEC entries). =ISNUM(42)→true, =ISERROR(1/0)→true, =ISBLANK(\"\")→true. FUNCTION_CATALOG now 38 entries. 1 new test. 324/324.","timestamp":1773883236336,"segment":0}
{"run":67,"commit":"2cc540c","metric":349,"metrics":{"h7_eval_ms":108},"status":"keep","description":"Peephole optimizer: constant folding for PUSH_NUM pairs + binary ops. =2+3 → PUSH_NUM(5), =2*3+4 → PUSH_NUM(10), =5>3 → PUSH_BOOL(true). Dead code elimination after HALT. FOLDABLE set covers 12 binary ops. 3 new tests. 327/327.","timestamp":1773883313292,"segment":0}
{"run":68,"commit":"c83dd81","metric":401,"metrics":{"h7_eval_ms":108},"status":"keep","description":"Unary constant folding: NEG + ABS on PUSH_NUM. =-5 → PUSH_NUM(-5). Fixed early-exit threshold (was < 3, now < 2). 1 new test. 328/328. Metric variance high (280-401ms range) — GC/scheduler noise.","timestamp":1773883413483,"segment":0}
{"run":69,"commit":"82c32e1","metric":342,"metrics":{"h7_eval_ms":108},"status":"keep","description":"=A1=5 equality operator in infix: = added to PREC (precedence 0) and INFIX_OP_MAP→EQ. Excel-compatible: =IF(A1=1,\"yes\",\"no\"). Works because leading = is stripped, remaining = are equality ops. 2 new tests. 330/330.","timestamp":1773883527231,"segment":0}
{"run":70,"commit":"9887b75","metric":351,"metrics":{"h7_eval_ms":108},"status":"keep","description":"FormulaEngineV2 text formula E2E: =UPPER(A1) & \" \" & UPPER(B1) with cascading recalc. Validates & operator + UPPER function + cell deps through full engine pipeline. 1 new test. 331/331.","timestamp":1773883570718,"segment":0}
{"run":71,"commit":"856d24f","metric":347,"metrics":{"h7_eval_ms":108},"status":"keep","description":"Error recovery E2E: one errored formula (div/0) doesn't block others in batch recalc. Verifies per-cell error catching + continuation + error reporting in RecalcResult. 1 new test. 332/332.","timestamp":1773883624551,"segment":0}
