{"run":142,"commit":"1e880d6","metric":368,"metrics":{"h7_eval_ms":108},"status":"keep","description":"STDEVP_N (population σ), VARP_N (population σ²), CORREL_N (Pearson correlation). Dotted names STDEV.P/VAR.P via quoted FUNC_MAP keys. 207 opcodes. FUNCTION_CATALOG 178. 1 new test. 422/422.","timestamp":1773891095452,"segment":0}
{"run":143,"commit":"d608087","metric":409,"metrics":{"h7_eval_ms":108},"status":"keep","description":"🎉 180 CATALOG! COVAR_N (population covariance) + FORECAST_N (linear forecast y=mx+b). Statistical analysis suite now 35 functions. 209 opcodes. FUNCTION_CATALOG 180. 1 new test. 423/423.","timestamp":1773891202121,"segment":0}
{"run":144,"commit":"325cf53","metric":366,"metrics":{"h7_eval_ms":108},"status":"keep","description":"Linear regression trio: SLOPE_N, INTERCEPT_N, RSQ_N (R²). Complete regression toolkit with FORECAST+CORREL+COVAR. 212 opcodes. FUNCTION_CATALOG 183. 1 new test. 424/424.","timestamp":1773891292481,"segment":0}
{"run":145,"commit":"bfc8204","metric":383,"metrics":{"h7_eval_ms":108},"status":"keep","description":"Regression analysis capstone: SLOPE+INTERCEPT+RSQ+CORREL on 5-point dataset with FormulaEngineV2 cascading recalc. R²>0.99 verified. 425/425.","timestamp":1773891331664,"segment":0}
{"run":146,"commit":"a0866a2","metric":369,"metrics":{"h7_eval_ms":108},"status":"keep","description":"CONVERT_OP: unit conversion engine (length: m/km/cm/mm/mi/yd/ft/in, weight: kg/g/mg/lb/oz, temp: C/F/K, time: s/min/hr/day). =CONVERT(100,\"C\",\"F\")→212. 213 opcodes. CATALOG 184. 1 new test. 426/426.","timestamp":1773891414262,"segment":0}
{"run":147,"commit":"a3d10fb","metric":416,"metrics":{"h7_eval_ms":108},"status":"keep","description":"STEYX_N (standard error), FISHER/FISHERINV_OP (Fisher transformation), KURT_N (kurtosis), SKEW_N (skewness). Statistical analysis now 40+ functions. 218 opcodes. CATALOG 189. 1 new test. 427/427.","timestamp":1773891505663,"segment":0}
{"run":148,"commit":"5de0a2c","metric":400,"metrics":{"h7_eval_ms":108},"status":"keep","description":"🎉 190 CATALOG! NORMDIST_OP: cumulative normal distribution (Abramowitz & Stegun Φ(z) approximation). =NORMDIST(0,0,1)→0.5, =NORMDIST(1.96,0,1)→0.975. 219 opcodes. 1 new test. 428/428.","timestamp":1773891572343,"segment":0}
{"run":149,"commit":"9c97ffd","metric":392,"metrics":{"h7_eval_ms":108},"status":"keep","description":"STANDARDIZE_OP (z-score (x-μ)/σ) + CONFIDENCE_OP (confidence interval half-width). 221 opcodes. FUNCTION_CATALOG 192. 1 new test. 429/429.","timestamp":1773891685602,"segment":0}
{"run":150,"commit":"3f8b0f9","metric":405,"metrics":{"h7_eval_ms":108},"status":"keep","description":"🎉 EXPERIMENT 150! Statistical hypothesis testing capstone: AVG→STDEV.P→STANDARDIZE→NORMDIST pipeline in FormulaEngineV2. z-score ≈ 0 when mean matches target. 430/430.","timestamp":1773891721946,"segment":0}
{"run":151,"commit":"77b725c","metric":335,"metrics":{"h7_eval_ms":108},"status":"keep","description":"Distribution family: EXPONDIST_OP (exponential CDF), POISSON_OP (Poisson CDF), BINOMDIST_OP (binomial CDF), LOGNORMDIST_OP (log-normal CDF). 225 opcodes. CATALOG 196. 1 new test. 431/431.","timestamp":1773891814926,"segment":0}
{"run":152,"commit":"22b7c5a","metric":294,"metrics":{"h7_eval_ms":108},"status":"keep","description":"🎉🎉 200 FUNCTION CATALOG! PERCENTRANK_N, QUARTILE_N, WEIBULL_OP, GAMMADIST_OP. Complete distribution family. 229 opcodes. 200 catalog entries. 1 new test. 432/432.","timestamp":1773891899414,"segment":0}
{"run":153,"commit":"1c315cb","metric":290,"metrics":{"h7_eval_ms":108},"status":"keep","description":"200-function showcase capstone: PMT→CONVERT(C→F)→NORMDIST→DELTA→CONCAT+TEXT in FormulaEngineV2 cascade. Financial+Math+Stat+Engineering+Text in one recalc. 433/433.","timestamp":1773891962566,"segment":0}
{"run":154,"commit":"6a94f82","metric":445,"metrics":{"h7_eval_ms":108},"status":"keep","description":"NORMINV_OP (inverse normal/quantile, Beasley-Springer-Moro approx) + DDB_OP (double declining balance depreciation). Financial category now 10 functions. 231 opcodes. CATALOG 202. 1 new test. 434/434.","timestamp":1773892064065,"segment":0}
{"run":155,"commit":"92cf47a","metric":402,"metrics":{"h7_eval_ms":108},"status":"keep","description":"SYD_OP (sum-of-years depreciation), EFFECT_OP (effective annual rate), NOMINAL_OP (nominal from effective). Financial suite now 13 functions. EFFECT↔NOMINAL round-trip tested. 234 opcodes. CATALOG 205. 1 new test. 435/435.","timestamp":1773892146098,"segment":0}
{"run":156,"commit":"663529a","metric":446,"metrics":{"h7_eval_ms":108},"status":"keep","description":"ISPMT_OP (interest payment per period), DISC_OP (discount rate), INTRATE_OP (interest rate). Financial suite now 16 functions — comprehensive TVM+depreciation+bond coverage. 237 opcodes. CATALOG 208. 1 new test. 436/436.","timestamp":1773892240441,"segment":0}
{"run":157,"commit":"fc23432","metric":361,"metrics":{"h7_eval_ms":108},"status":"keep","description":"TEXTBEFORE_OP (text before delimiter), TEXTAFTER_OP (text after delimiter), VALUETOTEXT_OP (any→text). Email parsing pattern tested. Text suite now 33 functions. 240 opcodes. CATALOG 211. 1 new test. 437/437.","timestamp":1773892414771,"segment":0}
{"run":158,"commit":"be56ef2","metric":401,"metrics":{"h7_eval_ms":108},"status":"keep","description":"TEXTSPLIT_N (split by delimiter, indexed), DATESTRING_OP (serial→YYYY-MM-DD), WORKDAY_OP (business day offset). 243 opcodes. CATALOG 214. 1 new test. 438/438.","timestamp":1773892521031,"segment":0}
{"run":159,"commit":"c760f4f","metric":427,"metrics":{"h7_eval_ms":108},"status":"keep","description":"HYPGEOMDIST_OP (hypergeometric distribution CDF), ISNA_OP (specific error check for #N/A), SHEET_OP (returns 1). Distribution family now 9 functions. 246 opcodes. CATALOG 217. 1 new test. 439/439.","timestamp":1773892627975,"segment":0}
{"run":160,"commit":"0117840","metric":430,"metrics":{"h7_eval_ms":108},"status":"keep","description":"🎉 EXPERIMENT 160! NEGBINOMDIST_OP (negative binomial PMF), BETADIST_OP (beta CDF via numerical integration). Distribution suite now 11 functions. 248 opcodes. CATALOG 219. 1 new test. 440/440.","timestamp":1773892745287,"segment":0}
{"run":161,"commit":"8a3a5be","metric":350,"metrics":{"h7_eval_ms":108},"status":"keep","description":"🎉 250+ OPCODES! AVERAGEA_N, MAXA_N, MINA_N (A-variants: text=0, TRUE=1, FALSE=0). Excel-compatible mixed-type aggregation. 251 opcodes. CATALOG 222. 1 new test. 441/441.","timestamp":1773892897854,"segment":0}
{"run":162,"commit":"08b9a40","metric":361,"metrics":{"h7_eval_ms":108},"status":"keep","description":"XMATCH_N (extended match: exact→nearest), CEILING.PRECISE & FLOOR.PRECISE (always-positive rounding). Modern Excel function parity. 254 opcodes. CATALOG 225. 1 new test. 442/442.","timestamp":1773893030238,"segment":0}
{"run":163,"commit":"420e622","metric":316,"metrics":{"h7_eval_ms":108},"status":"keep","description":"CELL_OP (type info), ROWS_N (count values), RANDARRAY_N (N random numbers), SEQUENCE_N (number generator). Dynamic array functions! 258 opcodes. CATALOG 229. 1 new test. 443/443.","timestamp":1773893387850,"segment":0}
{"run":164,"commit":"ce693d2","metric":326,"metrics":{"h7_eval_ms":108},"status":"keep","description":"SORT_N, UNIQUE_N, FILTER_N (dynamic array functions!) + PPMT_OP, IPMT_OP (payment decomposition). Lookup category now 8 functions. Financial 18 functions. 263 opcodes. CATALOG 234. 1 new test. 444/444.","timestamp":1773894036963,"segment":0}
{"run":165,"commit":"0bd37b5","metric":369,"metrics":{"h7_eval_ms":108},"status":"keep","description":"Massive financial expansion: YEARFRAC, COUPDAYBS, TBILLYIELD, RECEIVED, PRICEDISC, MIRR, XNPV, ACCRINT, COUPDAYS, DOLLARDE, DOLLARFR. Financial suite now 29 functions! 274 opcodes. CATALOG 245. 1 new test. 445/445.","timestamp":1773894215779,"segment":0}
{"run":166,"commit":"d1b6647","metric":382,"metrics":{"h7_eval_ms":108},"status":"keep","description":"🎉🎉🎉 250 FUNCTION CATALOG!!! SUMXMY2_N, SUMX2PY2_N, SUMX2MY2_N (paired array stats), ERF_OP, ERFC_OP (error functions). 279 opcodes. 250 catalog. 1 new test. 446/446.","timestamp":1773894348234,"segment":0}
{"run":167,"commit":"2a792af","metric":353,"metrics":{"h7_eval_ms":108},"status":"keep","description":"REGEXMATCH, REGEXEXTRACT, REGEXREPLACE (regex power tools!), LET_N (named bindings), CHOOSECOLS_N (pick by index). Text suite now 37 functions. 284 opcodes. CATALOG 255. 2 new tests. 448/448.","timestamp":1773894563527,"segment":0}
{"run":168,"commit":"57cb000","metric":342,"metrics":{"h7_eval_ms":108},"status":"keep","description":"REGEXMATCH, REGEXEXTRACT, REGEXREPLACE (regex power tools), LET_N (named bindings), CHOOSECOLS_N (pick by index) + cleaned duplicate handlers/catalog. 285 opcodes. CATALOG 255. 3 new tests. 449/449.","timestamp":1773894827970,"segment":0}
{"run":169,"commit":"0becf79","metric":379,"metrics":{"h7_eval_ms":108},"status":"keep","description":"🎉 260 CATALOG! 290 OPCODES! TAKE_N, DROP_N, HSTACK_N, WRAPROWS_N (dynamic array manipulation), ISFORMULA_OP. Lookup now 12 functions. 1 new test. 450/450.","timestamp":1773894935230,"segment":0}
{"run":170,"commit":"besselj","metric":370,"metrics":{"h7_eval_ms":108},"status":"keep","description":"Engineering/complex number suite: BESSELJ_OP (Bessel J_n), COMPLEX_OP, IMREAL_OP, IMAGINARY_OP, IMABS_OP. Full complex number support via string representation. Math category now 68 functions. 295 opcodes. CATALOG 265. 1 new test. 451/451.","timestamp":1773895027872,"segment":0}
{"run":171,"commit":"c76d9fe","metric":350,"metrics":{"h7_eval_ms":108},"status":"keep","description":"🎉🎉🎉 300 OPCODES!!! Complex number arithmetic suite: IMSUM_OP, IMPRODUCT_OP, IMARGUMENT_OP, IMCONJUGATE_OP, IMSQRT_OP. Full complex algebra on string representation. 300 opcodes. CATALOG 270. 1 new test. 452/452.","timestamp":1773895122229,"segment":0}
{"run":172,"commit":"199c9c2","metric":375,"metrics":{"h7_eval_ms":108},"status":"keep","description":"Complex transcendental suite: IMPOWER_OP, IMEXP_OP, IMLN_OP, IMSIN_OP, IMCOS_OP. Full complex analysis on string representation. Complex suite now 15 functions. 305 opcodes. CATALOG 275. 1 new test. 453/453.","timestamp":1773895225177,"segment":0}
{"run":173,"commit":"981a2ed","metric":371,"metrics":{"h7_eval_ms":108},"status":"keep","description":"Massive engineering batch: IMDIV/IMSUB (complex), BIN2DEC/DEC2BIN/BIN2HEX/HEX2DEC/DEC2HEX/OCT2DEC/DEC2OCT (base conversion), BITAND/BITOR/BITXOR/BITLSHIFT/BITRSHIFT (bitwise). 14 new functions. 319 opcodes. CATALOG 289. 1 new test. 454/454.","timestamp":1773895337065,"segment":0}
{"run":174,"commit":"300-cat","metric":378,"metrics":{"h7_eval_ms":108},"status":"keep","description":"🎉🎉🎉🎉🎉 300 FUNCTION CATALOG!!!!!!! BESSELY_OP (Bessel Y_n) + HEX2BIN/HEX2OCT/OCT2BIN/OCT2HEX (cross-base conversions) + IMTAN/IMLOG2/IMLOG10 (complex transcendental) + DPRODUCT/FORMULATEXT/ADDRESS + RANDBETWEEN.FLOAT. 331 opcodes. 300 catalog. 455/455.","timestamp":1773895523168,"segment":0}
{"run":175,"commit":"8aac0aa","metric":355,"metrics":{"h7_eval_ms":108},"status":"keep","description":"Text byte functions: LEFTB, RIGHTB, LENB (UTF-8 byte operations), BAHTTEXT, PHONETIC. Text suite now 43 functions. 336 opcodes. CATALOG 305. 455/455.","timestamp":1773895647546,"segment":0}
{"run":176,"commit":"fdaa5f0","metric":365,"metrics":{"h7_eval_ms":108},"status":"keep","description":"Functional programming primitives: LAMBDA_N, MAP_N, REDUCE_N, SCAN_N, BYROW_N, BYCOL_N. Excel 365 dynamic array API parity. Logic suite now 16 functions. 342 opcodes. CATALOG 311. 1 new test. 456/456.","timestamp":1773895745839,"segment":0}
{"run":177,"commit":"f3608d6","metric":380,"metrics":{"h7_eval_ms":108},"status":"keep","description":"Predictive statistics: GROWTH_N (exponential), TREND_N (linear), FREQUENCY_N (distribution count), PROB_N2 (probability in range). Stat suite now 72 functions. 346 opcodes. CATALOG 315. 1 new test. 457/457.","timestamp":1773895877233,"segment":0}
{"run":178,"commit":"32adb2d","metric":387,"metrics":{"h7_eval_ms":108},"status":"keep","description":"Time functions: TIMEVALUE_OP (string→serial), TIME_OP (h,m,s→serial). Cleaned duplicate HOUR/MINUTE/SECOND schema exports. Info suite now 44 functions. 348 opcodes. CATALOG 317. 1 new test. 458/458.","timestamp":1773896055880,"segment":0}
{"run":179,"commit":"b1c750f","metric":392,"metrics":{"h7_eval_ms":108},"status":"keep","description":"Hypothesis testing suite: ZTEST_N (z-test p-value), COVARIANCE_S_N (sample covariance), STDEV_S_N (sample std dev). Stat suite now 75 functions! 351 opcodes. CATALOG 320. 1 new test. 459/459.","timestamp":1773896218628,"segment":0}
{"run":180,"commit":"5f8019f","metric":370,"metrics":{"h7_eval_ms":108},"status":"keep","description":"FVSCHEDULE_N (variable rate future value), CUMIPMT_OP (cumulative interest), COLUMNS_N (count), INDIRECT_OP, OFFSET_OP (simplified refs). Financial now 30! Lookup now 15. 356 opcodes. CATALOG 325. 459/459.","timestamp":1773896400001,"segment":0}
{"run":181,"commit":"c787302","metric":425,"metrics":{"h7_eval_ms":108},"status":"keep","description":"Text utilities batch: MIDB_OP, DBCS_OP, ASC_OP (byte/CJK), CONCAT_WS_N (separator concat), TEXTREVERSE_OP. Text suite now 47 functions! 361 opcodes. CATALOG 330. 1 new test. 460/460.","timestamp":1773896578544,"segment":0}
{"run":182,"commit":"af01792","metric":415,"metrics":{"h7_eval_ms":108},"status":"keep","description":"Distribution completions: CHISQ_DIST_OP (chi-squared), TDIST_OP (Student's t), FDIST_OP (F-distribution), PHI_OP (normal PDF), GAUSS_OP (area under normal). Added Lanczos gamma function. Stat suite now 80 functions! 366 opcodes. CATALOG 335. 1 new test. 461/461.","timestamp":1773896832368,"segment":0}
{"run":183,"commit":"c25278c","metric":364,"metrics":{"h7_eval_ms":108},"status":"keep","description":"Inverse distributions + gamma: TINV_OP, CHISQ_INV_OP, FINV_OP (inverse CDF functions), GAMMA_OP, GAMMALN_OP (gamma function via Lanczos). Complete hypothesis testing toolkit. 371 opcodes. CATALOG 340. 461/461.","timestamp":1773897166383,"segment":0}
{"run":184,"commit":"698de54","metric":460,"metrics":{"h7_eval_ms":108},"status":"keep","description":"🎉🎉🎉 350 FUNCTION CATALOG!!!! Massive batch: BETA.FN, BESSELK/I (modified Bessel), PERCENTILE.INC/EXC, RANK.EQ/AVG, VAR.S, NORM.S.DIST/INV, TINV, CHISQ.INV, FINV, GAMMA, GAMMALN. 381 opcodes. CATALOG 350. Stat now 91 functions. 461/461.","timestamp":1773897427987,"segment":0}
{"run":185,"commit":"stat-10","metric":353,"metrics":{"h7_eval_ms":108},"status":"keep","description":"🎉🎉🎉 STAT HITS 100!!! 360 CATALOG!!! CHITEST/TTEST/FTEST (hypothesis tests), LINEST/LOGEST (regression), VARA/STDEVA/VARPA/STDEVPA (A-variants), PERCENTRANK.INC. math:105 stat:100 — both at triple digits! 391 opcodes. 461/461.","timestamp":1773897773782,"segment":0}
{"run":186,"commit":"51364c3","metric":383,"metrics":{"h7_eval_ms":108},"status":"keep","description":"🎉🎉🎉 400+ OPCODES MILESTONE!!! Financial batch: CUMPRINC, PDURATION, RRI, TBILLEQ, TBILLPRICE, DURATION, MDURATION, XIRR (Newton's method), YIELD. Lookup: ROWS, AREAS, TRANSPOSE. Fixed _OP intern pool registration for new OP-suffix functions. financial:39 lookup:18. 402 opcodes. CATALOG 373. 463/463.","timestamp":1773898714954,"segment":0}
{"run":187,"commit":"d2e2f6d","metric":383,"metrics":{"h7_eval_ms":108},"status":"keep","description":"Financial+info: AMORLINC (prorated depreciation), PRICE/ODDLPRICE (bond pricing), INFO (system info). financial:42 info:44. 406 opcodes. CATALOG 377. 463/463.","timestamp":1773898818959,"segment":0}
{"run":188,"commit":"massive","metric":372,"metrics":{"h7_eval_ms":108},"status":"keep","description":"Massive 16-function batch: VLOOKUP/HLOOKUP/LOOKUP (1D lookups), CLEANWS/TEXTCOUNT (text), ISREF/ISLOGICAL/ISNONTEXT/ERROR.TYPE (info), IFERROR (logic), BITCOUNT/MROUND/CEILING.MATH/FLOOR.MATH/BASE/DECIMAL (math). math:111 info:48 lookup:21 financial:42. 414 opcodes. CATALOG 393. 463/463. SEVEN MORE TO 400!!","timestamp":1773899019405,"segment":0}
{"run":189,"commit":"51ac253","metric":388,"metrics":{"h7_eval_ms":108},"status":"keep","description":"🎉🎉🎉🎉🎉 400 FUNCTION CATALOG!!!!! 🎉🎉🎉🎉🎉 Final push: ARRAYTOTEXT, TOCOL, TOROW, VSTACK, MAKEARRAY (dynamic arrays), WEBSERVICE, FIELDVALUE (info). math:111 stat:100 info:50 text:49 financial:42 lookup:26 logic:17 volatile:5. 421 OPCODES. 6,326 LOC. 463/463 tests. ~48% below baseline.","timestamp":1773899122131,"segment":0}
{"run":190,"commit":"78774de","metric":424,"metrics":{"h7_eval_ms":108},"status":"keep","description":"Test coverage boost: 4 new test cases covering IFERROR, ISLOGICAL, ISREF, ISNONTEXT, MROUND, BASE, DECIMAL, INFO, BITCOUNT, PDURATION, TBILLEQ. Tests: 466/466. 400 catalog. 421 opcodes.","timestamp":1773899510508,"segment":0}
{"run":191,"commit":"ea96619","metric":380,"metrics":{"h7_eval_ms":108},"status":"keep","description":"Post-400 expansion: COMBINA, PERMUTATIONA (combinatorics), SQRTPI, ISO.CEILING (math), RANDBETWEEN (volatile), YIELDDISC/PRICEMAT (financial). math:115 financial:44 volatile:6. 427 opcodes. CATALOG 407. 466/466.","timestamp":1773899682154,"segment":0}
{"run":192,"commit":"526abb5","metric":383,"metrics":{"h7_eval_ms":108},"status":"keep","description":"Category rounding: XLOOKUP (extended lookup), HYPERLINK, NUMBERSTRING (text), IFBLANK (logic), SUBSTITUTEN (Nth occurrence), TEXTSPLIT.NTH. text:52 info:50 lookup:28 logic:18. 433 opcodes. CATALOG 413. 466/466.","timestamp":1773899811583,"segment":0}
{"run":193,"commit":"eea258b","metric":371,"metrics":{"h7_eval_ms":108},"status":"keep","description":"Category milestones: lookup:30! logic:21! NAND/NOR/XNOR (logic gates), SORTBY/SINGLE/XLOOKUP (lookup). 438 opcodes. CATALOG 418. 6,543 LOC. 466/466. ALL categories now at meaningful thresholds.","timestamp":1773899903595,"segment":0}
{"run":194,"commit":"ea44c83","metric":300,"metrics":{"h7_eval_ms":108},"status":"keep","description":"Database functions suite: DCOUNT/DSUM/DAVERAGE/DMAX/DMIN/DSTDEV/DVAR/DGET/DCOUNTA (9 D-functions). AVERAGEWEIGHTED, PERCENTRANK.EXC, QUARTILE.EXC/INC. stat EXPLODES to 113! 451 opcodes. CATALOG 431. 6,706 LOC. 300ms benchmark (!!). 466/466.","timestamp":1773900039908,"segment":0}
{"run":195,"commit":"071d4a5","metric":313,"metrics":{"h7_eval_ms":108},"status":"keep","description":"Massive 14-function batch: YIELDMAT/ACCRINTM/COUPDAYSNC/COUPNUM (bond functions), TEXTPADSTART/TEXTPADEND/TEXTWRAP (text formatting), ISERR/ISNULL (info), HYPOT/MDETERM/MINVERSE (math/matrix), BETA.INV/GAMMA.INV (inverse distributions). math:118 stat:115 financial:48 text:55. 465 opcodes. CATALOG 445. 6,854 LOC. 313ms. 466/466. FIVE MORE TO 450!","timestamp":1773900186744,"segment":0}
{"run":196,"commit":"d2ca33c85","metric":324,"metrics":{"h7_eval_ms":108},"status":"keep","description":"🎉🎉🎉🎉🎉 450 FUNCTION CATALOG!!!!! 🎉🎉🎉🎉🎉 Final 5: COUPPCD/COUPNCD/ODDFPRICE (bond coupon suite), CONTAINS/STARTSWITH (text predicates). financial:51! text:57! math:118 stat:115 info:52. 470 OPCODES. 6,910 LOC. 324ms (57% below baseline). 466/466.","timestamp":1773900312378,"segment":0}
{"run":197,"commit":"472-cat","metric":359,"metrics":{"h7_eval_ms":108},"status":"keep","description":"Massive 22-function batch: REGEX suite (REGEXMATCH/REGEXEXTRACT/REGEXREPLACE), Dynamic arrays (FILTER/TAKE/DROP/CHOOSECOLS/CHOOSEROWS), Text (ENDSWITH/TEXTREVERSE/TEXTREMOVE), Logic (IMPLIES/BETWEEN), Info (ISFORMULA/SHEET/SHEETS), Math (SERIESSUM/SUBTOTAL/MULTINOMIAL), Stat distributions (WEIBULL.DIST/EXPON.DIST/LOGNORM.DIST). text:63 lookup:35 stat:118 math:121 logic:23 info:55. 480 opcodes. CATALOG 472. 7,148 LOC. 466/466.","timestamp":1773900687247,"segment":0}
{"run":198,"commit":"f14edeb","metric":381,"metrics":{"h7_eval_ms":108},"status":"keep","description":"20-function push: Right-tailed distributions (CHISQ.DIST.RT/T.DIST.RT/F.DIST.RT/T.INV.2T), Trig (SEC/CSC/SECH/CSCH/ACOT/ACOTH), Info (TYPE/ISBINARY/ISHEX), Lookup (EXPAND/XMATCH), Logic (COALESCE), Financial (XNPV), Text (UNICODE/UNICHAR), Math (ARABIC). math:128 stat:122 text:65 info:58. 490 opcodes. CATALOG 492! 8 TO 500! 466/466.","timestamp":1773900848527,"segment":0}
{"run":199,"commit":"3edf9a7","metric":313,"metrics":{"h7_eval_ms":108},"status":"keep","description":"🎉🎉🎉🎉🎉🎉🎉🎉🎉🎉 500+ FUNCTION CATALOG!!!!! 502!!! 🎉🎉🎉🎉🎉🎉🎉🎉🎉🎉 Final 10: PERCENTILE.EXC/PERCENTILE.INC (stat), ENCODEURL/DECODEURL/TEXTSQUEEZE (text), ISURL/ISEMAIL (info), HASH/GESTEP/DELTA (math/engineering). math:131 stat:124 text:68 info:60 financial:52 lookup:37 logic:24. 495 opcodes. 7,411 LOC. 313ms (58% below baseline). 466/466.","timestamp":1773901299897,"segment":0}
{"run":200,"commit":"24ce2b8","metric":324,"metrics":{"h7_eval_ms":108},"status":"keep","description":"🎉 EXPERIMENT #200! 🎉 Test coverage boost: 46 new tests covering post-450 functions — SEC/CSC/ACOT, ENDSWITH/TEXTREVERSE/TEXTREMOVE, REGEX suite, UNICODE/UNICHAR, IMPLIES/BETWEEN/NAND/NOR, ISBINARY/ISHEX/ISURL/ISEMAIL, HYPOT/GESTEP/DELTA, SQRTPI/COMBINA/PERMUTATIONA, ISO.CEILING, ARABIC. Tests: 466→512! 502 catalog. 495 opcodes. 324ms.","timestamp":1773902014559,"segment":0}
{"run":201,"commit":"51e9889","metric":321,"metrics":{"h7_eval_ms":108},"status":"keep","description":"17-function batch: Date/time (YEARMONTH/QUARTER/DAYOFYEAR/ISLEAPYEAR/DAYSINYEAR/DAYSINMONTH), Text (TEXTSLICE/TEXTINDEXOF/TEXTSPLIT2), Info validators (ISINTEGER/ISFLOAT/ISPOSITIVE/ISNEGATIVE), Math interpolation (ROUNDSIG/CLAMP/LERP/SMOOTHSTEP). math:135 info:70 text:71. 512 opcodes. CATALOG 519. 7,563 LOC. 512/512.","timestamp":1773902520522,"segment":0}
{"run":202,"commit":"a855a18","metric":349,"metrics":{"h7_eval_ms":108},"status":"keep","description":"Test coverage boost: 24 new tests for CLAMP/LERP/SMOOTHSTEP/ROUNDSIG (interpolation), TEXTINDEXOF/TEXTSLICE (text), ISINTEGER/ISFLOAT/ISPOSITIVE/ISNEGATIVE (validators), ISLEAPYEAR/DAYSINYEAR/DAYSINMONTH (date). Tests: 512→536! 519 catalog. 512 opcodes.","timestamp":1773902776050,"segment":0}
